Yes,Employed part-time,Yes,Sometimes,4,5,5,2,2,3,2,2,2,4,5,5,4,2,3,5,6,5,3,"I do not think that using digital or AI tools significantly impact my ability to think clearly or make decisions as I generally use AI as a 'backstop' to ensure that my decision or information is correct in a speedy and less taxing manner. However, I do think that it impacts my ability to fully rest my mind. I feel not entirely able to disconnect from digital systems and work for longer than I intended to as digital systems make things much easier to just keep going. Thinking about what I need to do and how I am going to do it is something that I have noticed more and more with increasing digital use and this impacts on my ability to rest my mind. ",Over 65,UK,Man
Yes,Employed full time,Yes,Often,4,4,3,4,3,4,5,4,4,4,4,4,5,4,4,4,4,4,4,I think AI tools have a positive effect on my abilities because they help me catch things I might not have thought of. In this way they enhance what I could do on my own.,45 - 54,US,Man
Yes,Employed full time,Yes,Everyday,5,6,4,7,3,6,5,1,4,1,1,1,4,5,2,2,5,3,5,It's like a bicycle for the mind; in its absence I can attain the same result but it helps me reach a decision quicker and gives me more clarity since my decision making is largely knowledge dependent.,35 - 44,UK,Man
Yes,Employed full time,Yes,Often,5,6,6,4,4,4,5,4,3,6,5,6,6,4,5,5,6,6,3,Sometimes my mind feels convoluted after work and I need a break from screens,45 - 54,US,Woman
Yes,Retired,Yes,Sometimes,2,5,3,2,2,2,2,5,2,5,5,6,5,2,2,5,5,6,3,"I use AI tools to suggest options that I havent thought of, especially when travelling to places I have not been to before.",Over 65,Australia,Man
Yes,Retired,Yes,Sometimes,5,3,3,3,2,1,1,1,1,1,1,1,2,2,2,2,2,3,2,if I have a problem digitally I can count on AI,Over 65,UK,Man
Yes,Employed full time,Yes,Very often,3,4,3,2,1,2,5,3,4,2,4,5,5,5,4,2,3,3,3,"Sometimes AI feels like too much of a shortcut, like a lot of the thought process of a decision goes out of the window and it becomes a different kind of process, just comparing an AI's output. I do feel this fundamentally changes something about how we arrive at decisions using evidence and statistics. ",35 - 44,UK,Man
Yes,Employed part-time,Yes,Often,5,3,5,3,1,3,1,1,1,5,5,5,7,1,1,2,5,5,1,"It's not how I use purposely AI myself that affects my decision making or stresses me, it's the ever present use of it in all forms of interaction that I require to make with any company or service provider. Wading through endless chat bots or AI systems is wearing, annoying and time consuming.",55 - 65,UK,Man
Yes,Employed full time,Yes,Everyday,3,3,2,2,3,2,5,5,6,6,5,6,6,4,6,5,4,5,2,"boost clarity by handling routine tasks, but they can also scatter attention and shrink the space for reflection. They make choices feel easier, though that convenience can weaken slower, more deliberate judgment. They help when used with limits, but without limits they keep the mind active when it needs to rest.",25 - 34,UK,Woman
Yes,Employed part-time,Yes,Sometimes,5,6,2,1,1,1,1,1,1,2,1,3,2,1,1,4,4,4,1,"I use it carefully to sense check or proof read content that I have generated myself.  It is very good to help edit down wordy content, or to adapt it to specific audiences and I always check that it has not changed the meaning or added/removed content that I did not want it to.  Like anything else (spellcheck, autocomplete, transcriptions etc) it is a tool in the toolbox and you need to understand what it can and can't do and quality check the results.",35 - 44,UK,Man
Yes,Unemployed and looking for work,Yes,Occasionally,7,7,7,4,7,7,5,3,3,7,7,7,7,5,6,7,6,7,3,"I feel like AI takes away my ability to exercise mental muscles, to keep functions such as original thinking and understanding processes through doing in tact. I worry that the demand to use AI will result in me relying on it to think for me, and strip me of the ability to think unique thoughts or produce original work; it somehow takes away my joy and sense of achievement I felt in the past in completing a task and producing useful results for a business myself, when the AI can do most of the work.",35 - 44,UK,Man
Yes,Employed full time,Yes,Sometimes,2,3,2,2,2,2,3,4,2,3,4,5,6,2,2,4,5,6,2,I think that right now AI just enhances what I provide but doesn’t take over or impact my ability to think clearly or make decisions/ ,35 - 44,US,Woman
Yes,Employed full time,Yes,Very often,3,3,5,5,6,3,5,6,7,6,7,7,7,2,2,1,3,4,1,it makes me less competent in making my own decisions and performing actions. ,18 - 24,UK,Woman
Yes,Employed full time,Yes,Everyday,2,1,3,2,2,1,5,5,4,3,5,4,6,1,1,1,1,1,2,it does not impact me ,35 - 44,UK,Man
Yes,Self-employed / freelance,Yes,Often,5,6,6,5,6,5,5,2,4,5,6,6,7,5,5,6,5,6,4,I have become too reliant on AI tools and this has negatively impacted my ability to think and act independently and autonomously.  This has resulted in heightened anxiety. ,55 - 65,UK,Man
Yes,Employed part-time,No,Never,4,6,4,2,1,3,1,1,1,2,2,2,1,1,1,7,7,7,1,"It doesn't, I don't know how it could actually do that for anyone.",45 - 54,US,Woman
Yes,Self-employed / freelance,Yes,Everyday,2,2,4,4,2,1,3,1,4,3,1,2,2,1,1,1,1,1,1,"AI tools are tools. I use them the same ways I use other tools. I translate screenshots with them. I correct grammar with them (not here :) ), I ask for recipes and so on. It would be weird to ask it for personal advice or start pouring my soul into computer. I use it as a tool and it is a great time saver compare to google. If its starts lying or pushing decisions - opening a new window usually solves a problem ",35 - 44,New Zealand,Woman
Yes,Employed full time,Yes,Everyday,2,2,2,3,2,2,6,6,2,2,2,2,6,2,2,2,2,2,6,Using AI helps to keep my thoughts organized.,35 - 44,US,Woman
Yes,Employed full time,Yes,Everyday,3,7,5,3,1,3,1,1,1,2,2,2,4,2,1,4,5,5,2,I really need breaks from screens in general and I use screen for digital and AI tools so I just need a break to rest my eyes and head sometimes.,45 - 54,US,Woman
Yes,Retired,Yes,Sometimes,5,6,4,5,6,5,3,4,3,5,6,5,6,5,3,3,5,4,3,It does depend on what purpose you're using AI for in my view and therefore the trustworthiness of the results obtained. I would always take each case individually to assess how to use the results and whether or not to accept them on face value or the need for further research. ,Over 65,UK,Man
Yes,Employed full time,Yes,Everyday,5,6,5,4,6,5,5,6,5,6,2,3,2,6,3,5,4,5,6,"I don't think it does, it just allows me to process and generate more output",35 - 44,UK,Man
Yes,Self-employed / freelance,Yes,Very often,5,5,4,4,4,4,4,3,4,4,4,4,6,4,3,5,5,6,3,"I need it to make sense of my thoughts and ideas. It helps me make decisions, which frees up my mind, and I then have confidence to do other things, away from screen and AI",45 - 54,UK,Woman
Yes,Employed full time,Yes,Very often,2,4,4,2,2,1,1,3,4,1,1,2,2,1,1,3,1,1,1,I dont think it affects my ability to think clearly. In a way I think that it actually helps me think more clearly because Im more aware ,45 - 54,US,Woman
Yes,Employed full time,Yes,Occasionally,3,4,5,3,2,3,2,2,2,5,6,5,6,2,2,5,6,6,2,"I feel like i always need to be switched on when using AI, I also feel like I need to proof read answers and even fact check ",35 - 44,UK,Woman
Yes,Employed full time,Yes,Often,5,6,6,5,4,4,2,3,5,5,5,4,4,3,3,4,4,5,6,"The models provide different answers to the same queries and also require multiple follow up questions to provide useful answers. You also have to fact check anything that's questionable or highly important.  After awhile, you're mentally exhausted and full of doubt while still needing and craving reliable information. You blame yourself for not being smart enough to use AI models",55 - 65,US,Woman
Yes,Employed full time,Yes,Sometimes,3,6,2,3,2,3,2,1,2,4,5,5,5,1,1,1,4,5,1,"i like using it to summarise large amounts of data in a concise way that helps me make choices, so it can be helpful, however on occasion i have noticed the summaries produced are not always accurate or are missing context so i still need to have a good grounded understanding of the source data",35 - 44,Australia,Man
Yes,Employed full time,Yes,Everyday,4,3,2,4,1,2,3,5,2,5,2,5,4,2,1,1,3,3,1,"If used in moderation AI tools don't really have much of an effect on my ability to think clear, but after using them for extensive periods of time it can become harder to distinguish at times between your own thoughts and those you have seen as responses via AI tools.",25 - 34,UK,Man
Yes,Retired,No,Never,4,4,1,1,1,1,1,1,1,1,1,1,1,1,1,1,4,4,1,"I don’t have any issues as I’m not a digital tool user. But I can imagine if it doesn’t understand the question it could be frustrating, tech is great when it works.",55 - 65,UK,Woman
Yes,Employed full time,Yes,Often,5,6,6,2,4,3,4,5,4,5,6,4,4,4,5,5,4,5,5,"When tools handle tasks like summarizing, calculating, or organizing, your mind has more space for deeper reasoning, creativity, or reflection. It’s like clearing mental clutter so you can focus on the parts that matter.",25 - 34,US,Woman
Yes,Employed part-time,Yes,Occasionally,3,5,5,2,2,1,5,2,1,2,5,5,5,1,1,1,1,1,1,I use it more of an aide then trusting on it solely. It doesnt effect my feelings but helps back up maybe what im feeling,35 - 44,UK,Woman
Yes,Self-employed / freelance,Yes,Occasionally,6,7,7,6,5,6,2,1,1,6,7,6,5,4,6,7,7,7,1,Using AI tools although it saves time is very mentally overloading ,55 - 65,UK,Woman
Yes,Employed full time,Yes,Everyday,2,3,2,3,2,2,6,3,2,2,2,3,2,3,2,2,5,4,2,"I always view AI as my own personal knowledgeable assistant, who works 24/7 without tiring or complaining. I can choose what I do myself and what I delegate. I can choose whether to listen to AI or to ignore it. I see using AI as a symbiotic relationship where I gain by being freed from the majority of research work and base analyses. I am freed up to focus on QA over AI feedback, and then deciding whether I need to research/analyze further before making a decision myself. I find this approach stimulating, reassuring and comforting; I can rest my mind when wanted and then employ my full brain power when needed.",55 - 65,UK,Man
Yes,Self-employed / freelance,Yes,Sometimes,4,4,4,3,2,1,2,4,4,5,6,6,5,3,3,3,4,3,1,I'm really not affected by it. ,45 - 54,US,Woman
Yes,Employed full time,Yes,Sometimes,5,4,4,1,1,1,1,1,1,5,5,1,1,1,1,7,7,7,1,"I have very clear and set boundaries that I do not cross so it doesn't. But I do understand and have personally felt the potential for this to happen, when I first started using AI. But I then learned what it is really useful for which is moreso things like framing and giving you structure instead of actual judgement of quality of things.",25 - 34,US,Man
Yes,Unemployed and not currently looking for work,Yes,Everyday,2,2,2,4,1,1,5,4,4,3,3,2,3,2,1,1,2,2,1,AI tools could assist to make decision more effectively,55 - 65,UK,Man
Yes,Employed full time,Yes,Everyday,2,5,1,4,1,1,4,2,1,2,1,1,1,1,1,1,1,1,1,It doesn't affect me because I'm not dependent on AI or any digital tools.,45 - 54,US,Woman
Yes,Employed full time,Yes,Everyday,2,2,2,2,2,2,6,6,4,4,2,2,2,5,2,5,5,4,5,few of the but just one i use regularly,35 - 44,UK,Man
Yes,Homemaker / caring for family,No,Rarely,5,4,3,2,2,4,1,2,1,2,2,1,1,1,1,5,4,3,3,"The overload of input from using a phone and apps clutters my already cluttered mind even more, its as if all the tabs are never closed, but multiplied. ",25 - 34,US,Woman
Yes,Employed part-time,Yes,Sometimes,4,4,4,5,3,3,3,3,3,4,5,5,4,5,4,3,4,3,3,"I don’t really have too much of an issue in thinking clearly, making decisions  or resting my mind after using AI but there are times when I feel that it improves my confidence when I do so and I’m less sure of myself without it sometimes ",Over 65,UK,Woman
Yes,Retired,No,Rarely,6,5,4,3,1,5,1,1,1,1,4,7,6,1,1,1,7,4,1,It is sometimes difficult to determine if the AI interpreted my question correctly and has provided a plausible answer.,55 - 65,US,Woman
Yes,Employed part-time,No,Never,1,4,1,1,1,1,1,1,1,1,1,7,7,1,1,1,3,3,1,I avoid AI use as much as possible. AI makes me furious. I do feel  irritated by how hard it is to avoid now.,45 - 54,US,Woman
Yes,Employed part-time,Yes,Occasionally,5,6,4,5,3,4,5,3,4,4,5,5,6,4,5,6,6,6,3,"Using digital and AI tools helps with efficiency, but constant interaction can cloud my thinking and make decisions feel less grounded. It becomes harder to fully switch off, and I often need deliberate breaks to regain mental clarity and focus.",18 - 24,UK,Woman
Yes,Employed full time,Yes,Occasionally,3,5,4,4,2,3,2,5,2,6,6,6,4,4,5,6,6,7,1,I use AI in my work sometimes to help with wording emails that might need a little extra attention. I also use it for some data analysis but have to be careful about the results I get because it’s not always accurate.,45 - 54,US,Woman
Yes,Employed full time,Yes,Often,1,1,1,5,1,1,3,4,3,1,1,1,1,1,1,4,7,6,2,"AI greatly enhances my ability to write succintly and clearly and that's how I use it mainly at work. Personally, I use it for recipes and miscellaneous queries. I'm always able to think clearly and make my own decisions. It rests my mind by saving me time.",Over 65,US,Woman
Yes,Employed full time,Yes,Everyday,5,3,5,6,3,2,6,7,5,4,3,6,3,3,2,5,6,5,6,"Sometimes I feel like when AI generates output there is so much detail that it becomes very overwhelming which affects my ability to think clearly, make decisions and rest my mind.",25 - 34,UK,Man
Yes,Employed full time,Yes,Often,4,3,3,3,1,2,5,5,3,4,3,5,3,4,3,3,6,5,2,"It makes it easier for me to remember good ideas and to make decisions. And offers conceptual clarity and distinctions, making me think clearly.",25 - 34,UK,Man
Yes,Unable to work due to illness or disability,Yes,Sometimes,6,7,7,5,2,5,2,1,1,5,3,5,4,5,4,7,7,7,1,"Often AI gives an extremely long answer which takes a long time to read and could be answered more succinctly.   It's annoying to need to check every video, photo, or post that I see on social media to tell whether it's AI-generated or not, so the better it gets, the more alienated I feel, as it blurs reality vs propaganda.  Google AI overview is often wrong or extremely biased and there's no way to turn it off, and it's hard to ignore, which is worrying.   ",Over 65,US,Woman
Yes,Employed full time,Yes,Occasionally,1,2,4,4,1,3,2,1,1,4,3,4,4,2,1,2,4,4,4,It has no effect because I do not rely on AI in my business or personal life,45 - 54,US,Woman
Yes,Self-employed / freelance,Yes,Often,4,5,2,7,2,2,5,3,3,3,3,3,7,5,2,7,6,7,2,Some times instead of thinking I let AI trigger a thought and ideas then I follow thorough,45 - 54,US,Woman
Yes,Employed full time,Yes,Often,4,4,3,3,2,2,3,4,5,3,3,2,5,2,2,2,2,3,2,I honestly don’t think it effects it but I do rely on it more and find myself not trying to think as hard ,35 - 44,US,Man
Yes,Employed part-time,Yes,Often,2,3,2,1,1,1,2,1,1,4,2,1,2,1,1,4,4,3,1,"I generally use it to double check things I already think are the case, or to check variances in documents. Therefore I find it really helps me organise my thoughts and be more confident with my assertions. It doesn’t stress me out or worry me.",35 - 44,UK,Woman
Yes,Employed full time,Yes,Everyday,2,3,1,7,1,6,2,6,1,1,1,1,1,1,1,4,5,3,3,Depending on what I am doing AI can boost my creativity and give me new ideas for me to explore,55 - 65,UK,Man
Yes,Employed full time,Yes,Occasionally,4,6,2,5,6,6,5,3,5,7,7,7,7,5,5,5,6,6,6,It can just make me second guess myself sometimes when I have to make a decision on my own. I find myself wondering what AI would say,25 - 34,UK,Man
Yes,Employed full time,Yes,Often,5,3,5,7,7,7,3,7,1,4,7,7,7,3,4,5,7,7,1,"I find it draining and unpersonal as well as making me feel lazy since in the past I always preferred to use my own brain when working on a task, whereas now my job requires me to use it on a regular basis which clashes with what I think of AI in general (not very positively) ",25 - 34,UK,Woman
Yes,Employed full time,Yes,Sometimes,5,7,3,2,3,5,2,1,3,5,4,3,6,3,4,6,7,3,2,I can get more anxious about making decisions and wonder  if what I'm doing is good enough. It's also easy to be too reliant on AI and not check the results well enough because I want to save time.,45 - 54,New Zealand,Woman
Yes,Employed full time,Yes,Often,4,5,6,6,5,2,3,4,2,6,5,4,6,1,2,3,5,6,2,"Using digital and AI tools helps me find information quickly and solve problems easily. However, too much can distract me, make thinking harder and disrupt my sleep. When I use them wisely, they improve my decision making. Overuse makes it harder to rest my mind.",45 - 54,UK,Man
Yes,Employed full time,Yes,Often,1,1,3,2,1,1,1,3,1,6,4,2,7,1,1,1,7,5,1,"I feel it encourages me to refine my ideas, which makes me think more. ",35 - 44,US,Man
Yes,Self-employed / freelance,Yes,Everyday,1,1,1,6,1,1,5,1,7,4,1,1,1,1,4,1,2,2,1,it helps me to make decisions and to think more clearly. it does also sometimes help me to rest my mind.,25 - 34,UK,Woman
Yes,Employed full time,Yes,Often,3,2,2,2,2,2,5,5,4,5,6,5,5,6,5,5,6,4,3,Whenever I use AI and it gives me advice that doesn’t turn out good it messes with my thoughts and mind.,35 - 44,US,Man
Yes,Unemployed and looking for work,Yes,Very often,3,5,4,4,3,4,6,4,4,4,3,4,3,5,4,4,3,4,4,"Using digital and AI tools helps me think and decide faster, but it can also make my mind feel crowded if I rely on them too much. They’re useful for organizing information, yet sometimes I need to step away from screens to think clearly and give my mind a break.",25 - 34,US,Man
Yes,Employed full time,Yes,Never,5,5,3,3,2,3,4,5,4,5,3,2,5,3,3,2,4,3,3,it makes me doubt myself,45 - 54,UK,Woman
Yes,Homemaker / caring for family,Yes,Very often,5,5,2,4,2,6,2,2,2,4,1,2,4,5,4,4,5,4,5,often the information given is not clear or needs more information. so it affects coming to decisions or completing tasks,35 - 44,UK,Woman
Yes,Employed part-time,Yes,Often,5,4,3,5,2,4,3,3,2,3,2,3,3,3,3,3,5,5,1,It’s just so much screen basically,25 - 34,UK,Woman
Yes,Employed full time,Yes,Everyday,2,5,3,5,2,2,7,3,3,5,3,7,5,3,3,5,6,4,4,Using AI supports my reasoning and thinking process when making every decision.,55 - 65,New Zealand,Man
Yes,Homemaker / caring for family,No,Rarely,2,2,2,2,2,2,1,4,2,4,2,2,5,1,2,1,6,6,1,You become automated in the information that you are gathering and not all outcomes is based on your own information ,35 - 44,UK,Woman
Yes,Employed full time,Yes,Very often,3,6,4,6,2,3,3,3,3,5,4,6,5,2,3,2,4,4,2,"It's not so much thinking clearly, but rather what you hinted at, that my decisions feel slighlty less mine because AI was involved in the process. This feels scary.",25 - 34,US,Man
Yes,Employed full time,Yes,Everyday,5,7,6,3,6,7,3,1,5,5,7,7,7,3,5,6,5,6,7,AI tools confuse me a lot as they often have imputs I want but also imputs I do not like so it makes me stress out sometimes and making decisions becomes harder because I do not know whom to trust anymore.,25 - 34,UK,Man
Yes,Employed full time,Yes,Very often,5,1,1,5,1,1,6,6,2,2,1,1,1,1,1,1,5,5,1,using AI tools helps me to see things in different ways. it helps me make decisions faster,35 - 44,US,Man
Yes,Employed full time,Yes,Very often,5,6,5,6,4,6,5,6,6,4,6,5,6,1,1,1,4,6,2,It helps me to manage daily tasks in everyday life so I can focus more on other things and tasks.,18 - 24,UK,Woman
Yes,Employed full time,Yes,Often,5,7,4,3,3,4,3,4,2,6,6,6,7,2,2,1,3,4,4,Sometime I become less confident in my own decision making abilities.,45 - 54,UK,Man
Yes,Employed part-time,Yes,Rarely,6,7,1,1,1,1,1,1,1,1,1,1,1,1,1,1,1,1,1,AI tools can make it difficult to tell what is authentic or legitimate in online spaces where it can easily masquerade as human. This can lead to a general distrust in art and writing.,25 - 34,US,Man
Yes,Employed full time,Yes,Sometimes,3,6,2,2,3,2,5,3,3,3,5,5,3,2,2,2,2,2,1,"Using digital or AI tools helps me think more clearly by walking me through the thought process of how we arrived at the answer and why it makes sense.It helps me make decisions usually by providing many thoughts, sides, or perspectives on things that I may not have thought of. Then, I can better make my choice or decision because I have more information or perspectives on the subject. I wouldn't say AI or digital tools rest my mind, per say. I do feel like it lessens the load and allows me to use less brain power, which makes the whole thing easier and less stressful.",35 - 44,US,Woman
Yes,Student,Yes,Everyday,3,2,2,3,2,2,5,4,5,2,3,3,3,2,2,1,2,2,3,it helps me make decisions and think clearer as it explains all aspects of the decision i ask it to tell me more about.,18 - 24,UK,Man
Yes,Retired,Yes,Everyday,1,2,2,2,2,2,2,1,3,2,2,2,1,1,1,1,1,1,1,Using AI tools like chat GPT does not affect my ability to think clearly if anything is helps me make decisions regarding purchasing items or deciding how to do something. I actually find using chat GPT allows my mind to be cleared rather than spending ages thinking about something I can get a quick answer from chance GPT and then can move on.,Over 65,UK,Man
Yes,Employed full time,Yes,Sometimes,4,4,4,4,4,4,5,4,3,4,4,4,4,1,1,1,4,4,1,I think AI makes decision making easier in general which makes everything more clear. ,25 - 34,US,Man
Yes,Self-employed / freelance,No,Never,1,2,1,1,1,1,1,1,1,6,6,7,7,1,1,4,6,7,1,"I don't trust AI, and I don't trust people who use AI. I make fun of AI whenever I do a survey with AI chatbot in it. The liberal bias is obvious. Woke is written into it, and I pity people who need woke AI to tell them how to think. I prefer to use my own mind. I can think for myself. ",55 - 65,US,Man
Yes,Unable to work due to illness or disability,No,Never,2,5,1,1,1,1,1,1,1,1,1,1,1,1,1,1,1,1,1,i have only used for studies that required me so don't have much experience although think they are good,55 - 65,UK,Woman
Yes,Employed full time,Yes,Sometimes,2,3,4,3,1,2,2,1,2,3,2,2,1,1,2,1,1,1,1,"I can confidently say that AI has no impact on my ability to think or make decisions.  I use it only as an aid, and to assist with drafting or answer a problem for me, but generally I prefer to rely on my own reasoning abilities.",45 - 54,UK,Man
Yes,Employed full time,Yes,Occasionally,3,3,3,5,3,3,2,3,3,4,5,5,4,3,3,5,4,5,2,"If I don't check every little thing, there's uncertainty about using it.",45 - 54,US,Man
Yes,Employed part-time,Yes,Often,1,2,2,3,1,1,1,1,1,5,3,4,6,1,1,1,2,3,1,I think when I use AI tools too much I become less focused on the smaller details because I think that the AI will take care of it and that can lead to some oversight.,35 - 44,US,Man
Yes,Self-employed / freelance,No,Rarely,7,7,7,4,4,7,1,1,1,4,4,4,6,2,1,4,4,4,1,"AI output isn't always accurate, and it doesn't always understand exactly what you are looking for, and being alert for this and double checking is time consuming and tiring. Even so, AI doesn't impact my ability to think clearly, or 'think for myself'.",55 - 65,UK,Woman
Yes,Employed full time,Yes,Occasionally,4,3,4,3,2,5,2,2,1,3,4,4,6,2,3,5,5,7,1,I sometimes question where the AI information actually comes from and whether it truly is reliable. I would rather just be able to trust it.,55 - 65,US,Woman
Yes,Employed full time,Yes,Everyday,5,6,4,5,6,3,5,6,3,5,6,6,5,6,4,3,7,5,4,It affects my critical thinking,35 - 44,UK,Man
Yes,Employed part-time,Yes,Sometimes,5,5,3,4,3,3,1,1,2,4,4,2,5,2,1,3,6,5,2,If anything it makes me think less then I start ton worry that I am not using my own mind and just trying to put the load onto AI and take a back seat ,25 - 34,UK,Woman
Yes,Employed full time,Yes,Very often,2,2,2,4,2,1,7,6,2,6,2,1,4,2,2,6,7,7,1,I appreciate using digital and AI tools. It helps me to not think so hard. My daily work requires a lot of research and figuring out problems. AI is a big help to me and allows me to get my work done faster and to give my brain a break.,55 - 65,US,Woman
Yes,Employed full time,Yes,Often,3,5,5,5,5,5,3,3,3,4,2,5,6,1,1,6,6,6,3,"Well you feel as if your decisions aren’t yours, they are not unique to you, you know yourself better than anyone does and this can make you question your ability to think freely ",25 - 34,UK,Woman
Yes,Employed full time,Yes,Very often,2,3,4,6,2,2,3,2,1,5,4,3,4,1,1,1,4,4,3,"AI has been significant in automatic mundane tasks and helped me develop med-legal writing to better write progress notes. While AI has been useful at work, it has been detrimental to me academically, especially during my data structures course. I found myself constantly referencing it and using it to solve my problems instead of using it more like a glossary. I've changed my approach now and feel at ease. However, I would have had a different perspective three weeks ago.",25 - 34,US,Man
Yes,Unemployed and looking for work,No,Sometimes,6,6,5,5,4,5,4,4,5,3,5,5,5,5,5,5,5,4,4,using AI makes me question some of my choices and decisions ,55 - 65,US,Man
Yes,Employed full time,Yes,Everyday,2,4,2,4,1,1,1,2,1,5,6,4,6,1,1,5,7,6,1,AI supports my own decision making process but never dominates.,55 - 65,Australia,Man
Yes,Employed full time,Yes,Everyday,2,3,3,4,5,2,5,5,6,5,4,2,4,5,5,4,5,5,2,it all depends on the scenario,25 - 34,UK,Man
Yes,Self-employed / freelance,Yes,Rarely,4,7,5,2,2,2,1,1,1,2,1,2,4,1,1,3,3,2,1,IT doesn't really. I rarely use AI tools for work or personnal use,35 - 44,Australia,Man
Yes,Employed full time,Yes,Sometimes,7,7,7,4,1,7,1,1,1,4,4,1,1,1,1,1,4,7,1,Personally it has no affect on me other than I just deeply hate using it. I only touch that useless shit because it's required at work.,25 - 34,US,Man
Yes,Unemployed and looking for work,Yes,Very often,6,3,2,5,1,4,5,5,6,3,5,3,5,1,1,2,3,3,1,They make it harder not to feel so anxious and make me a bit overstimulated at times.,55 - 65,US,Man
