consent,prolific_id,work_status,ai_tools_use,ai_tools_frequency,mentally_taxed_ai_prompts,ai_info_trust_drains_focus,switching_ideas_ai_flow_harder,meta_thinking_when_using_ai,lose_track_own_vs_ai_thoughts,brief_ai_sessions_mind_cluttered,rely_ai_suggestions_decisions,follow_ai_over_instinct,less_confident_without_ai_input,ai_decides_detached_from_outcome,question_if_decision_truly_mine_ai,ai_blurs_judgment_automation,worry_ai_weakens_independent_decisions,mind_replays_ai_interactions,hard_to_switch_off_after_ai,need_time_away_to_feel_myself,short_ai_breaks_clear_head,day_disconnected_ai_calm_grounded,uneasy_without_ai_long_periods,open_text_ai_effects_on_thinking,age_group,country,gender
Yes,5f072bda6cd79c09f05284cb,Employed full time,Yes,Sometimes,4,4,5,4,4,3,4,4,4,5,5,5,5,3,3,4,4,3,3,"I think using AI affects my ability to make my own personal decisions as it does become easier to rely on AI to make decisions for me, leading to potential mistrust of myself, and lack of clear thinking. However, using AI does make it easier to rest my mind as the software does the bulk of the thinking for me. ",25 - 34,UK,Woman
Yes,5f1088e27a43fe0c64ca5814,Employed full time,Yes,Sometimes,4,6,7,2,3,5,1,2,1,2,4,3,4,1,2,3,6,6,1,"It does sometimes feel that trying to distinguish from my original thought to the one presented by AI can be blurred. Sometimes the way things are reworded by AI makes me think, didn't I just say that, so makes me question my judgement or knowledge and then leads me down another rabbit hole of finding that out. ",55 - 65,UK,Woman
Yes,5f29eff59714081a3594a331,Employed full time,Yes,Everyday,2,2,2,2,1,1,1,1,1,2,1,1,5,1,1,1,4,1,1,I use AI every day only to confirm that the work I do is accurate.,35 - 44,New Zealand,Man
Yes,5f2aeacd1064b9427cae308e,Employed full time,Yes,Occasionally,4,5,3,2,1,4,1,3,2,5,5,6,6,1,1,1,4,5,1,"I don't tend to have any issue with thinking clearly, making decisions or having a restful mind with AI use but I tend to prefer to not be over reliant on AI as I don't trust it 100% & think it is better to have human input without too much AI.",35 - 44,UK,Woman
Yes,5f30a3aafe3e9550d0b8333d,Employed part-time,No,Occasionally,1,1,1,1,1,1,1,4,1,1,1,1,1,1,1,1,1,1,1,"It has no current effect on me as my use is limited, when I do use it it has little effect on me.",45 - 54,New Zealand,Man
Yes,5f4102e52cd459256b5014a9,Employed part-time,Yes,Rarely,3,4,3,2,3,3,2,3,4,6,4,3,7,2,3,7,7,6,1,Using AI helps me make plans for holidays or work out medical ailments much quicker than googling for research. So it really helps me make decisions quickly and often helps me be more logical in my thinking too.,Over 65,UK,Woman
Yes,5f4412624052727181839e3a,Employed full time,Yes,Occasionally,4,6,2,5,6,6,5,3,5,7,7,7,7,5,5,5,6,6,6,It can just make me second guess myself sometimes when I have to make a decision on my own. I find myself wondering what AI would say,25 - 34,UK,Man
Yes,5f57be602095072bb238a7ab,Employed part-time,Yes,Sometimes,1,1,1,1,1,3,1,3,1,1,1,1,3,1,1,1,4,5,1,"i make a point if not being reliant on AI and i wont be using it for advice, i use it for information only, i find it interesting that i now see ads for chatgbt on regular tv making it seem like we need it to make what seems like logical action that can be decided ourselves, i appreciate how  good it is for knowledge like planning a trip but not for asking how i should feel or act in situations, its a fine line between Ai being helpful and making life easier and overly ridiculously and scarily intrusive  ",45 - 54,UK,Woman
Yes,5f6091647826e603c6451677,Employed part-time,Yes,Often,3,3,4,3,4,3,3,4,4,3,4,4,5,4,4,3,3,3,2,It can sometimes blur your way of thinking and you can get persuaded when maybe your gut is telling you other things. But you can come to rely on it and think it is making better choices than you are.,25 - 34,UK,Woman
Yes,5f6388bf9ae5ad07ba1a0173,Employed full time,Yes,Occasionally,1,2,4,4,1,3,2,1,1,4,3,4,4,2,1,2,4,4,4,It has no effect because I do not rely on AI in my business or personal life,45 - 54,US,Woman
Yes,5f6e76757befe43b22307387,Employed full time,Yes,Often,5,7,4,3,3,4,3,4,2,6,6,6,7,2,2,1,3,4,4,Sometime I become less confident in my own decision making abilities.,45 - 54,UK,Man
Yes,5f7750471fcf840f542f6081,Employed full time,No,Occasionally,4,5,1,5,1,2,1,1,1,1,2,3,2,2,1,1,4,4,1,I sometimes question whether the information that AI provides is up to date and correct. That’s why I like to save posts about certain things and add to them when I know more. ,35 - 44,UK,Man
Yes,5f84e472052cf81ae5752252,Employed full time,Yes,Occasionally,1,1,1,1,1,1,1,1,1,1,1,1,1,1,1,1,1,1,1,it does not affect me like this,35 - 44,UK,Woman
Yes,5f871995a3c40d0cbee04d20,Employed full time,Yes,Often,5,6,6,2,4,3,4,5,4,5,6,4,4,4,5,5,4,5,5,"When tools handle tasks like summarizing, calculating, or organizing, your mind has more space for deeper reasoning, creativity, or reflection. It’s like clearing mental clutter so you can focus on the parts that matter.",25 - 34,US,Woman
Yes,5fa2e56fe794555527f2c8ef,Self-employed / freelance,No,Never,1,5,6,1,4,4,1,1,1,1,1,1,7,1,1,1,1,6,1,I don't use AI tools as I'm worried they will affect my ability to think clearly and make balanced decisions.,25 - 34,UK,Woman
Yes,5fb4f7b816ba5b1868ac6bd2,Employed part-time,Yes,Often,5,5,5,5,4,4,1,1,2,3,3,5,5,2,2,2,3,1,1,The amount of information presented is sometimes overwhelming so it's hard to reach a decision as to the way forward. Often there are no sources mentioned to support the ideas presented which gives a level of uncertainty as to the reliability of the tool.,55 - 65,UK,Man
Yes,5fb551ccab996500099ab1aa,Employed full time,Yes,Everyday,5,4,2,2,2,2,5,5,2,2,2,2,2,1,1,1,4,1,1,"It doesn't, I think it makes it easy and provides better insight to help make a more better informed decision. ",35 - 44,UK,Man
Yes,5fb809a247aaee22c2a204fc,Employed full time,No,Sometimes,3,4,3,2,1,4,1,2,1,4,4,4,7,1,2,1,3,4,1,"It's a lot of information to process at once. Usually you have to look up the different topics, but with AI it will just spit everything out all at one time",25 - 34,US,Woman
Yes,5fba1c3bc7bb9a62797d57d0,Employed full time,Yes,Everyday,5,4,4,4,2,2,4,2,4,3,4,4,4,2,4,4,4,4,1,Sometimes I can be indecisive about whether to use the idea from AI or my own but I overcome the indecision quite quickly.,45 - 54,UK,Man
Yes,5fd6744da6778c581ec7bcef,Employed part-time,Yes,Occasionally,3,5,3,2,1,4,1,1,1,2,2,3,5,2,5,5,5,4,5,I don't use AI a lot at present. However I do use digital tools everyday.  I find that I can get pulled down different rabbit holes and need a clear purpose and time frame to remain clear and focused. My mind looks for the distraction of digital tools. I worry about that. However when I am working creatively or writing something- it is still my work. I don't use AI to help me draft at present.  ,55 - 65,Ireland,Woman
Yes,5fd76b7d246a3705a25c9a94,Employed part-time,No,Rarely,2,3,1,1,1,2,1,1,1,4,4,4,5,1,1,2,4,5,1,I don't use AI programmes very often but I can definitely tell when I have been using screens too much and know I need to take a break and unwind. I think too much tech use is not something our brains are used to.,35 - 44,UK,Woman
Yes,5fd979cd5bc47d2522d06e18,Employed full time,Yes,Sometimes,3,6,2,3,2,3,2,1,2,4,5,5,5,1,1,1,4,5,1,"i like using it to summarise large amounts of data in a concise way that helps me make choices, so it can be helpful, however on occasion i have noticed the summaries produced are not always accurate or are missing context so i still need to have a good grounded understanding of the source data",35 - 44,Australia,Man
Yes,5fefefa4c9707d3516361c9c,Employed full time,Yes,Sometimes,1,1,1,2,1,1,2,4,1,2,2,2,6,1,1,1,4,2,1,"The only problems I experience are if I spend hours using the computer with no breaks. I have to get up, walk away and take breaks or else I feel fried.  I have no problems with AI",55 - 65,US,Woman
Yes,5ff238852178d171f9c973b7,Employed full time,Yes,Often,4,5,3,4,3,3,5,4,5,4,4,5,4,5,4,4,5,3,5,"Using AI tools both helps and hinders me.  AI can help free up my mind by doing a lot of leg work and analysis for me.  On the other hand, sometimes I can find myself overrelying on AI without using enough of my own reasoning.  Therefore, AI can help free up some mental capacity for me to think, but it can hinder my decision making process if I rely on it too often.",25 - 34,US,Man
Yes,5fff2877a99bcb65a14a223c,Employed full time,No,Sometimes,4,5,5,5,4,4,5,6,5,5,5,5,2,2,2,2,2,2,2,"Using digital or AI tools helps me make quicker decisions, but constant use can clutter my mind and make it harder to fully switch off",25 - 34,UK,Man
Yes,6008bb26b4bbfe568fa29d80,Unemployed and looking for work,No,Occasionally,4,4,5,5,5,3,2,4,2,2,3,4,3,2,2,2,4,4,2,"I don't use AI tools to help me make decisions, I mostly use it to learn",25 - 34,US,Man
Yes,60107ab840ea853ac4654517,Employed full time,Yes,Very often,4,6,5,2,3,2,2,5,2,6,5,4,6,4,2,2,5,3,1,It doesn’t? I find that I can think quite clearly regardless,35 - 44,UK,Woman
Yes,601171f52ffe110619bc0d93,Employed full time,Yes,Sometimes,1,1,1,1,1,1,1,2,1,1,1,2,1,1,1,2,7,4,1,"I don't feel it does, I only use it sometimes and when I do, it is me that feeds the info. to AI in the first place then I myself decide which piece of info. it provides I will use",55 - 65,UK,Woman
Yes,601c277aabe00c6bc759bf69,Employed full time,No,Occasionally,2,3,4,4,1,2,1,1,1,4,4,3,6,1,1,1,4,4,1,I avoid using it unless absolutely necessary. I believe it reduces people's critical thinking skills,25 - 34,UK,Man
Yes,601ef22cb13fd83f1f43393e,Employed full time,No,Occasionally,2,2,2,3,2,2,1,1,1,2,2,2,3,1,1,1,2,2,2,I haven't experienced any problems using digital or AI tools,35 - 44,UK,Man
Yes,60250e892b5c5727eeeef076,Retired,Yes,Everyday,1,2,2,2,2,2,2,1,3,2,2,2,1,1,1,1,1,1,1,Using AI tools like chat GPT does not affect my ability to think clearly if anything is helps me make decisions regarding purchasing items or deciding how to do something. I actually find using chat GPT allows my mind to be cleared rather than spending ages thinking about something I can get a quick answer from chance GPT and then can move on.,Over 65,UK,Man
Yes,6034cb7ee10e21aaad71814a,Employed full time,Yes,Sometimes,2,3,2,2,2,1,1,2,2,1,2,3,2,2,1,1,3,4,1,I think using AI tools helps me think and gives me ideas which help me come to conclusions faster ,25 - 34,UK,Woman
Yes,603d3e53d42711c0d0c38b30,Employed full time,Yes,Everyday,6,6,5,6,7,5,5,3,4,7,7,7,7,3,3,7,7,7,1,"I often find myself with brain fog after having used AI systems throughout the day, as it almost stops my brain from forming its own thoughts as I find myself automatically going to ChatGPT for a quick answer.",25 - 34,UK,Woman
Yes,6043df064bb99241f1a7c32d,Employed full time,Yes,Sometimes,3,2,4,2,4,4,1,4,1,1,1,2,5,3,1,1,1,4,1,Algorithms basically deciding and recommending videos on YouTube and same with Netflix! Showing you content that you may like going off previously watched series and films. Sometimes it can have you in a bubble in which you basically watch content YouTube recommends.,25 - 34,UK,Man
Yes,6048c1da4fb34916883f2e7d,Homemaker / caring for family,No,Rarely,2,2,2,2,2,2,1,4,2,4,2,2,5,1,2,1,6,6,1,You become automated in the information that you are gathering and not all outcomes is based on your own information ,35 - 44,UK,Woman
Yes,604a7e9f84bf0e7937200df5,Employed full time,Yes,Sometimes,5,4,4,1,1,1,1,1,1,5,5,1,1,1,1,7,7,7,1,"I have very clear and set boundaries that I do not cross so it doesn't. But I do understand and have personally felt the potential for this to happen, when I first started using AI. But I then learned what it is really useful for which is moreso things like framing and giving you structure instead of actual judgement of quality of things.",25 - 34,US,Man
Yes,60524a9ece19f6b376473cf7,Employed full time,Yes,Often,1,1,1,1,1,1,5,2,1,5,6,2,1,1,1,1,1,1,1,It doesn’t change ,35 - 44,UK,Man
Yes,6054cdc28222dc1ca6f58d8c,Self-employed / freelance,Yes,Sometimes,4,6,4,5,5,5,5,4,5,5,4,4,4,4,5,4,4,4,5,Get answers without really thinking about it.,35 - 44,UK,Woman
Yes,605da0a3b78d54d78f618ba4,Self-employed / freelance,Yes,Often,5,6,6,5,6,5,5,2,4,5,6,6,7,5,5,6,5,6,4,I have become too reliant on AI tools and this has negatively impacted my ability to think and act independently and autonomously.  This has resulted in heightened anxiety. ,55 - 65,UK,Man
Yes,605ff0746397c26c436b88af,Self-employed / freelance,Yes,Occasionally,4,6,5,4,3,4,4,4,4,4,4,4,4,1,1,1,4,4,1,It doesn’t affect it much ,35 - 44,US,Woman
Yes,606b6705399a272af8238dad,Self-employed / freelance,Yes,Often,1,1,1,1,2,1,2,3,4,2,1,2,3,1,1,2,3,1,2,"Personally I think AI really helps me both personally  and in my business. I use it to ask advice on various topics, but also to create business emails, social media posts etc and I never really feel overwhelmed using it...",55 - 65,US,Woman
Yes,609c34dac301d73f3684005d,Employed full time,Yes,Often,5,7,6,5,2,7,1,1,1,1,7,7,7,1,4,5,3,7,1,It really blurs things and ive to waste time validating the outputs,35 - 44,Ireland,Man
Yes,609d952e0aeb66af769d89cb,Employed full time,Yes,Occasionally,5,3,6,4,3,5,1,1,1,2,2,4,7,1,1,1,1,4,1,"Using AI doesn't affect me much in life as I try to avoid using it as much as possible. I sometimes use it when writing greetings cards / messages, which can make me feel like the message hasn't really come from me.",18 - 24,UK,Woman
Yes,609eda349f5d29975fbc2145,Employed full time,Yes,Everyday,5,4,4,1,2,3,6,4,2,4,2,2,5,1,1,1,5,3,1,"Sometimes I can see things that I don't want to think about, and even when I ask AI tools questions that I can actually solve, I dull my brain by not letting it work.",35 - 44,UK,Woman
Yes,60a2a8570a0f9cc00d6b9d1a,Self-employed / freelance,Yes,Very often,4,4,2,6,2,3,5,2,2,4,2,2,3,2,1,1,2,2,1,I believe a large amount of screen time requires a break from it for short periods of time to rest the mind.,45 - 54,US,Woman
Yes,60ad389232ead133c46d932a,Employed full time,Yes,Occasionally,5,6,6,2,1,3,5,3,2,5,6,6,6,2,2,1,3,2,1,I feel a large sense of guilt when I use AI - like I am cheating,35 - 44,UK,Woman
Yes,60b9f19b32e36bf883457fdc,Self-employed / freelance,Yes,Very often,1,1,1,5,1,1,5,2,1,5,4,2,5,1,1,1,4,5,1,"I do sometimes think that using AI tools too much detracts from my ability/willingness to make my own independent decisions, which is slightly concerning to me.",55 - 65,UK,Woman
Yes,60bd4bfc88b646e72d772977,Employed full time,Yes,Sometimes,1,1,1,1,1,1,7,7,1,7,1,1,1,1,1,1,1,1,1,"I feel like it allows me to rest my mind. Normally for me, I just use AI to revise things, so I can confidently say they are at least my own thoughts.",35 - 44,US,Woman
Yes,60ceeec3a0bed4a1e603b8d7,Employed full time,Yes,Often,3,2,3,3,2,2,3,2,2,5,4,4,5,2,2,5,6,6,2,"I think the human mind needs to sit in silence and boredom to rest, and using digital/AI tools overstimulates the mind and detracts from the necessary silence.",35 - 44,US,Man
Yes,60d075b6af3d46debaf3cfd8,Unemployed and looking for work,No,Rarely,3,4,7,4,1,7,1,4,1,7,7,7,7,4,4,3,4,4,1,I have only used Ai a few times because it makes me feel like I cannot think for myself and takes away my critical thinking skills. The few times I used it I felt unsure if I was truly making decisions myself and it confused me more than if I had put the effort in to make a decision without it.,18 - 24,UK,Woman
Yes,60ddc62b071a009e0b0c2922,Employed full time,Yes,Occasionally,1,1,2,2,1,1,1,1,1,1,5,4,7,2,1,4,4,5,1,I just think it can make me feel more tired and just put me in a generally poor mood.,35 - 44,UK,Man
Yes,60e7db20a383c138681c72a2,Self-employed / freelance,Yes,Everyday,2,2,4,4,2,1,3,1,4,3,1,2,2,1,1,1,1,1,1,"AI tools are tools. I use them the same ways I use other tools. I translate screenshots with them. I correct grammar with them (not here :) ), I ask for recipes and so on. It would be weird to ask it for personal advice or start pouring my soul into computer. I use it as a tool and it is a great time saver compare to google. If its starts lying or pushing decisions - opening a new window usually solves a problem ",35 - 44,New Zealand,Woman
Yes,60e911d8667eccfdd32a590e,Employed full time,Yes,Often,6,5,3,6,3,5,5,4,3,5,3,4,5,5,5,5,5,6,3,"I usually find digital/AI tools useful in helping to cut down on the volume of information I need to use for my decisions and this is less overwhelming for me. However, I then tend to use them to make more decisions so it can be mentally taxing after a while.",35 - 44,New Zealand,Woman
Yes,60ed8f50e13ce18a6d406a09,Employed full time,Yes,Occasionally,3,3,3,5,3,3,2,3,3,4,5,5,4,3,3,5,4,5,2,"If I don't check every little thing, there's uncertainty about using it.",45 - 54,US,Man
Yes,60f8658bf9d1627d3bc87a3d,Employed full time,Yes,Often,4,4,4,1,4,1,1,4,1,4,4,4,4,2,2,2,2,4,4,i feel AI doesn't have a significant impact on my mind,25 - 34,UK,Woman
Yes,60ff13bf692c2c24bfe600fd,Employed full time,Yes,Often,5,6,6,4,4,4,5,4,3,6,5,6,6,4,5,5,6,6,3,Sometimes my mind feels convoluted after work and I need a break from screens,45 - 54,US,Woman
Yes,6100180297ab80766a61d66e,Homemaker / caring for family,Yes,Very often,5,6,2,2,1,2,5,2,1,2,3,2,2,1,1,1,1,1,1,"I don't think that it affects my ability to think clearly, make decisions, or rest my mind. I am still very independent in my thoughts and tend to only use ai when i want to speed up the process of finding an answer to something i would otherwise google ",35 - 44,US,Woman
Yes,610acbfd3ae11a1b16a1c3ee,Employed full time,Yes,Often,3,3,3,2,3,2,4,4,3,4,3,3,3,5,5,3,3,3,4,it provides me with inspiration to expand on y own ideas at work,35 - 44,UK,Woman
Yes,610b1f14463b800b75ec7b44,Employed full time,Yes,Sometimes,3,6,2,5,1,2,4,2,2,6,6,4,6,2,2,2,3,2,1,It saves me time initially but then later it causes me more challenges when I need to analyse the answers or double/triple check to be sure what I am being told is correct. Over time this can become more taxing and leads me to question more than without using AI tools.,35 - 44,Australia,Man
Yes,610c66163e803a3564dfaf9c,Self-employed / freelance,Yes,Often,5,5,5,5,4,5,4,3,4,5,5,4,5,5,3,4,5,6,3,Sometimes I wonder if the judgements and conclusions are my own or if it is AI,18 - 24,UK,Man
Yes,611c602eb1c81e9a397985e1,Employed full time,Yes,Occasionally,5,6,5,4,5,5,2,2,2,4,6,4,6,4,4,4,5,5,1,AI has made me question everything I see online and I don’t trust anything it says ,35 - 44,US,Woman
Yes,612842ca25ad8ffd1b8e44ec,Unemployed and looking for work,Yes,Sometimes,5,5,6,3,2,5,4,1,2,7,7,7,7,1,1,1,5,4,1,"It can take away the human aspect of thinking, although I always try and go over its answers to check it/change it to be more human",18 - 24,UK,Man
Yes,612fa6644526903f736cf925,Employed full time,Yes,Often,4,3,2,4,3,3,4,3,2,3,1,4,2,5,5,4,6,4,2,you concentrate so hard on the prompt sometimes you loses focus on exactly what you were asking. your mind gets muddled.,55 - 65,US,Man
Yes,6137e32367aae15b0156bd7e,Employed full time,Yes,Rarely,2,4,2,5,3,2,2,3,1,5,4,6,5,1,1,5,7,6,2,I struggle to rest as im having to use my eyes for screen interaction then my mind and voice when using voice prompts to generate responses and that can take a mental toll over time and leave me feeling reliant on the technology making me uneasy,35 - 44,UK,Man
Yes,614e65edaccea7bee04b8ad8,Employed full time,Yes,Everyday,6,7,7,7,4,5,4,3,2,5,7,7,6,3,3,6,6,7,5,I find myself second guessing my decisions as I've become somewhat reliant on AI to assist my decision making. The longer I spend away from AI the better my decision making becomes.,55 - 65,Australia,Man
Yes,6151a607b886850c924ff6ec,Employed full time,Yes,Everyday,2,4,2,4,1,1,1,2,1,5,6,4,6,1,1,5,7,6,1,AI supports my own decision making process but never dominates.,55 - 65,Australia,Man
Yes,6152f73a30aafa46c799b32f,Employed full time,Yes,Everyday,2,5,1,1,1,1,6,7,1,1,1,1,1,1,1,1,7,3,1,AI recommends suggestions and enables me to think and follow processes to achieve my goals and answers. ,Over 65,UK,Man
Yes,6154b537a93b01369670a9f5,Employed full time,No,Occasionally,6,4,5,5,2,5,3,3,5,6,4,4,4,5,3,5,3,5,5,"I sometimes use AI to write emails or work for me when I've hit a block, I'll ask it to add empathy or soften what I've said. I usually use it to edit rather than to create. I find that it makes me feel like i'm getting more stupid and less able to think for myself - i feel lazy when I use it because I'm quite capable of doing the tasks i'm asking it to do",25 - 34,UK,Woman
Yes,6157040a78451d0e36577a2a,Employed part-time,No,Rarely,2,5,5,2,2,4,1,3,1,5,1,6,6,2,1,3,5,6,1,"Using AI makes me over think the outcome, whether its correct and whether I should be using it as part of day today life",25 - 34,UK,Woman
Yes,615e420a23219efe3427a367,Employed full time,Yes,Often,1,1,1,5,1,1,3,4,3,1,1,1,1,1,1,4,7,6,2,"AI greatly enhances my ability to write succintly and clearly and that's how I use it mainly at work. Personally, I use it for recipes and miscellaneous queries. I'm always able to think clearly and make my own decisions. It rests my mind by saving me time.",Over 65,US,Woman
Yes,6163f8a826c9b98b20139416,Employed part-time,Yes,Often,5,3,5,3,1,3,1,1,1,5,5,5,7,1,1,2,5,5,1,"It's not how I use purposely AI myself that affects my decision making or stresses me, it's the ever present use of it in all forms of interaction that I require to make with any company or service provider. Wading through endless chat bots or AI systems is wearing, annoying and time consuming.",55 - 65,UK,Man
Yes,61fa94df5719bc09cb835064,Self-employed / freelance,Yes,Sometimes,2,4,2,2,2,2,3,2,2,4,2,2,2,2,2,2,4,2,2,I feel like using AI tools helps me to distill things down better to allow for me to actually think clearly. I can offload some simple decisions or tasks and then I can focus on what's needed.,45 - 54,US,Man
Yes,62162ab583fc823e78c025e2,Employed part-time,Yes,Sometimes,5,6,2,3,1,6,1,2,3,2,1,4,7,1,1,1,4,4,1,I need to be on guard for wrong information frequently. I feel that I'm actually training it sometimes and it's taxing.,55 - 65,US,Woman
Yes,6229fff149374541c22a95bf,Retired,No,Occasionally,1,1,1,1,1,1,4,3,2,2,2,1,1,1,1,1,1,1,1,AI is a tool that gives good solid additional information that helps me make a good decision. It also helps in most cases confirm my decision by giving supporting information. It also gives suggestions that I may have not thought of. It is a great tool for me. It is a search engine on steroids.,Over 65,US,Man
Yes,622a4d6cf143081ed1887ee5,Retired,Yes,Occasionally,2,2,1,1,1,1,2,1,1,1,1,1,1,1,1,1,2,2,1,"It doesn't. It is possible that if I used them more than I do, it could affect my ability to think clearly, but I only occasionally use them and I do not feel any effect on my ability to think or make decisions.",Over 65,US,Woman
Yes,6238b95932e705108020765a,Employed full time,Yes,Sometimes,7,7,7,4,1,7,1,1,1,4,4,1,1,1,1,1,4,7,1,Personally it has no affect on me other than I just deeply hate using it. I only touch that useless shit because it's required at work.,25 - 34,US,Man
Yes,623a4d7294028cfe9638272f,Self-employed / freelance,Yes,Occasionally,5,7,3,6,2,5,1,1,1,5,4,3,5,1,1,5,6,7,1,"I try to minimize my use of AI, saving it for work tasks. I am afraid of using it for writing, as I don't want to lose my creativity and my unique voice. I only use it for unimportant tasks and decisions because I have found it to be highly inaccurate and shallow.",55 - 65,US,Woman
Yes,6266a849331cc893a5b22cf6,Self-employed / freelance,Yes,Sometimes,4,4,5,5,1,2,2,1,1,3,5,5,7,2,2,2,7,4,3,"Sometimes, there is a bit of a reliance on AI tools that encourages mental laziness, which results in less time to think clearly on your own.",55 - 65,US,Man
Yes,62682277645054f5802459b8,Retired,Yes,Often,5,5,3,3,1,4,3,3,3,4,3,3,5,1,1,1,1,1,1,doesn't affect my ability to think clearly in any way,55 - 65,UK,Man
Yes,62795033eec9c814d8caf988,Employed full time,Yes,Everyday,2,2,3,5,2,2,5,2,3,2,2,3,5,1,1,1,4,3,1,"I believe that I'm getting lazier and lazier as I'm relying on AI more to help me make decisions without using my own mind. I sometimes feel like I can't think for myself and think this is due to me using AI more and more. I need a rest for AI at periodic intervals to go through my thoughts and think more clear, original ideas",25 - 34,UK,Man
Yes,627a659dc19a74aab841d292,Employed full time,Yes,Everyday,1,2,3,2,2,3,5,4,3,5,5,6,7,2,3,5,6,7,2,I worry the AI system is not giving me the correct information so it's gives me anxiety ,25 - 34,UK,Woman
Yes,628e24c80b3e2b2e0d7a5af1,Employed part-time,Yes,Often,1,2,2,3,1,1,1,1,1,5,3,4,6,1,1,1,2,3,1,I think when I use AI tools too much I become less focused on the smaller details because I think that the AI will take care of it and that can lead to some oversight.,35 - 44,US,Man
Yes,62a7477981491179fd5f1f6c,Employed full time,Yes,Occasionally,4,4,5,3,2,5,3,3,2,4,2,4,6,3,4,3,6,3,2,It takes the pressure of a decision away although I dont want to rely on it.,35 - 44,UK,Woman
Yes,62b74ec256808d84b3e691d6,Unemployed and not currently looking for work,Yes,Occasionally,3,6,4,5,2,4,1,2,1,1,1,2,3,2,2,1,2,4,1,"i only use ai infrequently, and mainly to generate images such as birthday cards for friends.  In this context, I find it helpful as it quickly gets the task done for me, so it actually is more restful for me than having to create the cards manually.  In terms of other interactions with ai, I mostly come across these when doing surveys for Prolific.  Here, I do find the conversations mentally taxing, and it can be quite difficult steering the AI in the direction you want, as well as mentally demanding trying to assess its accuracy",35 - 44,UK,Man
