consent,prolific_id,work_status,ai_tools_use,ai_tools_frequency,mentally_taxed_ai_prompts,ai_info_trust_drains_focus,switching_ideas_ai_flow_harder,meta_thinking_when_using_ai,lose_track_own_vs_ai_thoughts,brief_ai_sessions_mind_cluttered,rely_ai_suggestions_decisions,follow_ai_over_instinct,less_confident_without_ai_input,ai_decides_detached_from_outcome,question_if_decision_truly_mine_ai,ai_blurs_judgment_automation,worry_ai_weakens_independent_decisions,mind_replays_ai_interactions,hard_to_switch_off_after_ai,need_time_away_to_feel_myself,short_ai_breaks_clear_head,day_disconnected_ai_calm_grounded,uneasy_without_ai_long_periods,open_text_ai_effects_on_thinking,age_group,country,gender
Yes,6633fa4ebe0a692fc1a5f422,Employed full time,No,Sometimes,2,1,4,1,1,1,4,5,4,6,7,7,7,1,1,4,4,5,1,It makes me less confident about making my own decisions. But also saves me time,25 - 34,UK,Man
Yes,66358d404b95112d53513391,Employed full time,Yes,Everyday,2,3,2,3,2,2,6,3,2,2,2,3,2,3,2,2,5,4,2,"I always view AI as my own personal knowledgeable assistant, who works 24/7 without tiring or complaining. I can choose what I do myself and what I delegate. I can choose whether to listen to AI or to ignore it. I see using AI as a symbiotic relationship where I gain by being freed from the majority of research work and base analyses. I am freed up to focus on QA over AI feedback, and then deciding whether I need to research/analyze further before making a decision myself. I find this approach stimulating, reassuring and comforting; I can rest my mind when wanted and then employ my full brain power when needed.",55 - 65,UK,Man
Yes,6638d4ee19c87bca8a26a415,Employed full time,Yes,Everyday,2,1,3,2,2,1,5,5,4,3,5,4,6,1,1,1,1,1,2,it does not impact me ,35 - 44,UK,Man
Yes,663a7a5976c8f577c563362a,Employed part-time,Yes,Occasionally,4,3,3,1,2,4,3,2,2,5,4,5,6,1,1,7,7,7,1,"often when i am using AI tools, the amount of information it gives me is often large and cluttered so it takes more time to go through and analyze the results for accuracy. by having results and information generated it does save time initially, but having to comb through and check for accuracy is often draining as it feels like a menial task.",25 - 34,US,Woman
Yes,663a94c4f1f80e7c9c8a2d19,Employed full time,No,Rarely,3,6,6,6,6,6,3,5,3,5,5,3,5,5,3,5,3,5,3,I think it feels like it add clutter. It's hard to pick a part AI results into something refined. ,25 - 34,US,Woman
Yes,664439645a9a29be43d5bf5a,Retired,No,Rarely,4,4,4,6,1,4,1,4,1,4,2,4,4,1,1,1,1,4,1,Can cause you to be less inclined to search out information or learn on your own.,35 - 44,US,Man
Yes,664d3ff00a00a73398ac3f4f,Employed full time,Yes,Occasionally,5,3,5,6,5,6,3,2,2,3,3,6,7,4,5,7,7,7,1,Overload of words and information and very quickly spat out by the AI so i don't have time to think.,45 - 54,US,Man
Yes,664df63bbadb5bfc6fab223b,Student,Yes,Everyday,3,6,6,4,5,5,3,1,2,5,5,5,6,1,2,5,5,4,2,SOmetimes instead of fixing the error I kepp asking teh AI to fix teh error which drains all my energy,25 - 34,UK,Man
Yes,66510a0d8ae2bdbdf89d24cf,Homemaker / caring for family,Yes,Often,2,2,2,3,2,3,2,4,4,3,2,3,6,3,2,4,3,4,2,I don't think it affects me negatively. Instead it helps me with suggestions helping me feel more confident in what I was looking for.,35 - 44,US,Woman
Yes,66547fc259d4bc7ed73542d0,Self-employed / freelance,No,Rarely,2,5,2,1,1,5,1,1,1,1,6,6,6,1,1,6,6,7,1,I work ai tools just create a feedback loop and encourage what you were already thinking instead of helping one to use critical thinking skills,45 - 54,US,Woman
Yes,66565f702a8c21be63eb93ce,Self-employed / freelance,Yes,Everyday,5,5,4,5,4,3,4,4,2,4,4,3,4,4,4,4,5,4,2,"Using digital and AI tools helps me get information quickly, but sometimes it makes my mind feel tired. I have to think a lot about whether the information is correct and how to ask the right questions. This can make it harder to think clearly or relax. Even though the tools are useful, they can also add extra mental effort.",25 - 34,UK,Man
Yes,6657b0d02e5dfa6c2663a647,Unemployed and looking for work,Yes,Often,2,3,2,2,3,4,3,3,2,3,2,3,5,4,3,2,4,3,2,"I would say it can be helpful for me to make a more informed decision, but don't feel like it has a strong effect on how I think or my ability to rest my mind.",35 - 44,US,Man
Yes,6658b12b0f761f4d8def85b3,Employed full time,Yes,Very often,4,5,6,4,2,3,5,2,3,5,6,4,7,1,1,2,3,5,2,I feel like I automatically reach for AI tools rather than defaulting to my own brain power and it scares me,25 - 34,UK,Woman
Yes,6658b3b6347b527af5f3bad3,Employed full time,Yes,Occasionally,3,3,5,4,2,5,4,5,6,3,3,6,2,5,3,5,3,1,5,Using AI helps with important decisions it don’t make me think not clearly,25 - 34,UK,Man
Yes,6658b4ae84cb793eeaa040b1,Employed part-time,No,Rarely,1,1,1,1,1,1,1,1,1,1,1,1,1,1,1,3,5,4,4,It consumes me sometimes to the point where it can become addictive.,35 - 44,UK,Woman
Yes,6658bba1a51a037d25bb677e,Homemaker / caring for family,No,Rarely,5,4,3,2,2,4,1,2,1,2,2,1,1,1,1,5,4,3,3,"The overload of input from using a phone and apps clutters my already cluttered mind even more, its as if all the tabs are never closed, but multiplied. ",25 - 34,US,Woman
Yes,6658c4239af9537eefdfbcc9,Employed full time,No,Rarely,5,6,5,5,5,5,5,4,5,5,5,5,5,5,4,5,5,4,5,I use it sometimes but don't want to become reliant on it,25 - 34,UK,Woman
Yes,6658d66a5e45cac0aaeb54de,Employed full time,Yes,Often,2,3,2,1,1,1,2,4,1,4,1,1,1,1,1,1,3,1,1,It does not affect my ability to make decisions or think clearly.,25 - 34,UK,Woman
Yes,6658d84e36a39b239367aed9,Employed full time,Yes,Sometimes,2,2,2,1,3,2,1,5,2,5,4,6,7,2,1,2,4,4,1,"I think using AI tools is almost lazy, when I've used AI, I'm basically using AI to do the thinking for me. I'm not convinced this is a good thing overall for the human race. ",35 - 44,UK,Man
Yes,6658dd700eb742f84c1ecd57,Employed full time,Yes,Often,2,2,5,5,2,1,3,5,2,6,2,3,3,1,1,7,7,3,1,Prior to putting anything into AI you have some kind of understanding what the answer will be as its a thought process. However when AI puts a different outcome all together then it makes it simpler and clearer and thinks of different avenues you havent. ,35 - 44,Australia,Woman
Yes,665a16dd2db5a0dff976ea9b,Employed full time,Yes,Very often,5,6,5,6,4,6,5,6,6,4,6,5,6,1,1,1,4,6,2,It helps me to manage daily tasks in everyday life so I can focus more on other things and tasks.,18 - 24,UK,Woman
Yes,665c302327136dcdb0c4a2e0,Employed full time,Yes,Everyday,1,1,1,1,1,1,4,6,1,7,2,1,1,3,2,6,7,4,4,I don’t think it really affects my ability to think. I still have my own thoughts and am easily able to seperate my own thoughts from AI and/or think without AI. However it does make decision making easier sometimes. And I feel like it puts me at ease instead of questioning if I’m making the right decision,25 - 34,UK,Woman
Yes,665c955224ed3dc01981b68d,Student,No,Never,1,5,1,1,1,1,1,1,1,1,1,1,7,1,1,1,1,1,1,I do not use AI tools specifically because I think it would undermine my ability to think and make decisions and do things for myself,25 - 34,UK,Woman
Yes,665fc9a4ba95668b3533ddb9,Student,Yes,Everyday,2,2,1,5,2,1,5,2,2,4,2,5,5,1,1,1,1,1,1,I think it helps with productivity as I use it at a starting point for brief ideas,18 - 24,New Zealand,Man
Yes,6662f201ccf41c36e7408562,Self-employed / freelance,Yes,Everyday,1,1,1,6,1,1,5,1,7,4,1,1,1,1,4,1,2,2,1,it helps me to make decisions and to think more clearly. it does also sometimes help me to rest my mind.,25 - 34,UK,Woman
Yes,666328d8677a71d72b2544f2,Self-employed / freelance,Yes,Often,5,3,5,6,2,4,4,1,2,4,6,3,7,2,3,7,7,7,3,"Sometimes it help to not overthinking. If I suggest AI to be brutally honest and get to the point, it is easier for me.",25 - 34,UK,Woman
Yes,66647dac6b4645950f758d55,Employed full time,Yes,Often,6,4,5,7,2,4,5,2,2,6,7,5,7,4,3,3,4,3,4,I tend to dive deeper when AI keeps makeing more suggestions or offering more ways to help. I want to just get an answer sometimes and not keep going when they ask if I constantly want more help (ChatGPT ),Over 65,US,Woman
Yes,6667949cdf3bb5e82096a10b,Employed full time,Yes,Sometimes,2,2,2,1,2,1,2,1,1,4,2,2,2,5,5,2,2,2,2,It helps me say what I want to say in a more coherent way,35 - 44,US,Woman
Yes,666d9f87e4767cb47225a9cf,Unemployed and looking for work,Yes,Everyday,1,1,1,1,1,1,5,4,1,1,4,4,4,1,1,1,1,7,1,"Using for every small decision will make my mind think I should stop over using it, use it only necessary and my mind will not make right decisions.",25 - 34,US,Woman
Yes,66704327b46c7665de1190bc,Employed full time,Yes,Often,5,6,5,6,7,4,2,2,5,6,4,6,5,5,3,5,6,4,4,"Sometimes after using AI tools, I feel less confident in my own capability to solve the issue as AI has provided the answers. ",55 - 65,Ireland,Man
Yes,66723b1f7c3cf6961f0868a3,Homemaker / caring for family,Yes,Occasionally,6,5,5,6,3,4,3,1,4,3,3,3,6,2,2,2,6,6,4,"It can sometimes make things too complex, but it can also simplify and give information at a glance. If I don't trust what it is saying then I cross reference with another source. Regarding input, it can be a time waster giving it varied instructions in order to achieve a good outcome.",45 - 54,Australia,Woman
Yes,6674d66310b6684b86ddf7b9,Retired,Yes,Sometimes,5,5,5,5,5,5,3,3,3,4,5,5,5,6,4,7,7,6,2,"I am one of those people who are always thinking. I like using my mind. I compose essays about things in my head.  AI doesn't bother me as an idea generator, but it stresses me if it suggests points, arguments, etc. for an idea that is mine. I also dislike suggestions for making choices unless I specifically ASK for that. It's unsettling, confusing and also in some way feels like cheating. ",55 - 65,US,Woman
Yes,667a7ab2a6179deb78e9dd1a,Employed full time,Yes,Occasionally,4,6,4,4,3,5,2,1,1,5,5,5,6,3,3,3,3,5,1,"Using AI gives sometimes extensive options, sometimes helpful and sometimes obstructive.",45 - 54,UK,Man
Yes,667b56b086373fdd0b1ea4a3,Employed full time,Yes,Very often,2,2,2,4,2,1,7,6,2,6,2,1,4,2,2,6,7,7,1,I appreciate using digital and AI tools. It helps me to not think so hard. My daily work requires a lot of research and figuring out problems. AI is a big help to me and allows me to get my work done faster and to give my brain a break.,55 - 65,US,Woman
Yes,6684928e82e515000197f9c6,Self-employed / freelance,Yes,Occasionally,3,5,3,3,3,3,2,3,3,5,5,5,5,2,2,2,4,3,4,It really hasn't affected much so far. I think the only thing is maybe I might want to get a second opinion using an ai tool before making a big decision.,35 - 44,US,Man
Yes,668995230e63dee5f0165681,Employed part-time,Yes,Often,3,1,3,2,2,1,4,3,5,5,2,3,2,2,1,4,6,4,2,You become more reliant on these tools and often become lazy and use common sense. It is easier to just use AI tools as opposed to thinking hard,25 - 34,UK,Woman
Yes,668dc78c1b388adf48d7f329,Self-employed / freelance,Yes,Often,4,5,2,7,2,2,5,3,3,3,3,3,7,5,2,7,6,7,2,Some times instead of thinking I let AI trigger a thought and ideas then I follow thorough,45 - 54,US,Woman
Yes,668dc7b684452eaca13eb60d,Student,Yes,Occasionally,3,4,5,3,2,4,2,6,2,4,1,4,5,5,4,3,4,2,2,I think I view it as an advisory tool so I can recognise I do use it for decisions but I am not solely reliant on it. I might use it for mind clarity advise but not as a source ,18 - 24,UK,Woman
Yes,66929a6a268ccf0d6fce0d52,Unable to work due to illness or disability,No,Never,2,5,1,1,1,1,1,1,1,1,1,1,1,1,1,1,1,1,1,i have only used for studies that required me so don't have much experience although think they are good,55 - 65,UK,Woman
Yes,6692e6d4b97500a3b6f6efec,Unemployed and not currently looking for work,No,Rarely,2,2,4,4,3,4,2,3,1,1,3,1,1,2,1,1,4,1,1,"I think they rest my mind by helping me conclude information on topics, allowing me to free my mind from the worries of certain things.",35 - 44,US,Man
Yes,66968d3ed7be85f1b534d393,Homemaker / caring for family,Yes,Occasionally,4,3,4,4,3,3,3,4,3,3,3,4,4,2,2,2,4,4,3,I use AI to mainly check information on certain medical topics. I read the answers and cross check on non AI platforms mainly to cover all bases and give me peace of mind,55 - 65,UK,Woman
Yes,6697cf02d714e7ee3fdedcec,Employed full time,No,Rarely,2,3,2,2,1,2,1,2,2,6,2,2,2,1,1,3,4,4,1,I'm not sure it does very much personally. The only way I would suggest digital life affects my ability to concentrate is the sometimes constant buzz of notifications from my phone. ,35 - 44,UK,Man
Yes,669ad78bb5cd9126ab098737,Self-employed / freelance,Yes,Sometimes,5,6,5,2,2,3,2,2,2,6,6,6,6,3,3,5,6,7,2,Sometimes I feel as though I've lost control of things if I use AI too much.,55 - 65,UK,Man
Yes,66a260ef5f01e17796db665a,Self-employed / freelance,Yes,Rarely,5,5,6,1,1,5,1,1,1,5,1,6,7,1,1,5,6,5,1,"I overall get frustrated by a lot of digital/AI tools being unreliable, and limit my use of them.",18 - 24,US,Non-binary
Yes,66a2812744e8026f80ef0879,Self-employed / freelance,Yes,Often,5,7,5,5,3,5,4,3,3,5,4,5,6,1,5,6,5,7,4,Most of my interactions are with the AI summaries that my browser supplies when I do a search. I find that it's easy to rely on those summaries when I know that they are frequently less than accurate. Something about the presentation gives them a sort of authority. I have to force myself to check them. I worry about the implications for decision making.,45 - 54,US,Man
Yes,66a35864d80b66f563731c3e,Employed part-time,Yes,Very often,6,4,5,7,5,4,7,6,7,4,6,2,2,6,1,2,5,3,1,i am reliant on Ai,45 - 54,UK,Woman
Yes,66a56853eae42f430895b05e,Unable to work due to illness or disability,Yes,Occasionally,2,4,1,1,1,1,1,1,2,3,1,1,6,1,1,1,2,1,3,"I just use these tools to identify details so that I can make informed decisions, for instance about products and services. I do not offload decision-making authority at all.",45 - 54,US,Woman
Yes,66a7e6fca40c46efc356cfed,Employed full time,Yes,Everyday,3,4,3,3,2,2,5,4,4,5,3,5,5,2,1,1,1,1,3,"it doesn't affect my ability, it helps it, it makes things easier to process and draft things, so effectively it helps rest my mind sooner than if i did not use AI tools",25 - 34,UK,Man
Yes,66a807039d81fd60509841dc,Employed full time,Yes,Often,3,5,4,3,3,3,3,4,5,5,1,3,6,1,2,2,1,2,1,"i am not good at making decisions so they help me, not hinder",35 - 44,New Zealand,Man
Yes,66ae09b41fe460731834c749,Self-employed / freelance,No,Rarely,5,5,6,1,1,2,1,3,1,6,5,5,6,1,1,4,5,3,1,I only use ai for entertainment purposes.  ,55 - 65,US,Woman
Yes,66aedcd99676fd80376f04a5,Unemployed and looking for work,Yes,Often,5,4,4,5,6,5,2,4,5,6,5,3,6,3,5,6,7,5,4,It makes me lazy to think for myself occasionally ,25 - 34,Australia,Man
Yes,66af5f10833b8be554d9bef1,Retired,Yes,Sometimes,2,5,3,2,2,2,2,5,2,5,5,6,5,2,2,5,5,6,3,"I use AI tools to suggest options that I havent thought of, especially when travelling to places I have not been to before.",Over 65,Australia,Man
Yes,66b01097e95b0626c2cd7b5c,Employed full time,Yes,Very often,2,3,4,6,2,2,3,2,1,5,4,3,4,1,1,1,4,4,3,"AI has been significant in automatic mundane tasks and helped me develop med-legal writing to better write progress notes. While AI has been useful at work, it has been detrimental to me academically, especially during my data structures course. I found myself constantly referencing it and using it to solve my problems instead of using it more like a glossary. I've changed my approach now and feel at ease. However, I would have had a different perspective three weeks ago.",25 - 34,US,Man
Yes,66b0e84dc09d50097e52fe8a,Student,Yes,Occasionally,5,5,6,4,3,5,3,4,3,5,6,5,5,3,5,6,5,5,2,sometimes draining to figure out if the response can actually be trusted,18 - 24,UK,Woman
Yes,66b244a2f436437d3e109bbe,Self-employed / freelance,Yes,Everyday,3,7,5,4,5,3,7,4,7,7,7,3,7,4,1,5,5,7,7,"Using AI tools seems to have an affect where it drags me into a rabbit hole if that's a good way to put it. It seems to capture my mind and make me want to keep engaging and keep generating more from more prompts. I think it helps me learn more about the world but I find that I start to overly rely on it and if I try not to use it, I find that I feel less confident about my own decision making ability.",25 - 34,UK,Man
Yes,66b2b72c604d2d6bfd2372bf,Unemployed and looking for work,Yes,Very often,6,3,2,5,1,4,5,5,6,3,5,3,5,1,1,2,3,3,1,They make it harder not to feel so anxious and make me a bit overstimulated at times.,55 - 65,US,Man
Yes,66b792a09354b3fa1a3c5af9,Employed full time,Yes,Everyday,2,3,3,4,5,2,5,5,6,5,4,2,4,5,5,4,5,5,2,it all depends on the scenario,25 - 34,UK,Man
Yes,66bbafb05de7e549455aa4ff,Employed full time,Yes,Sometimes,2,3,4,3,1,2,2,1,2,3,2,2,1,1,2,1,1,1,1,"I can confidently say that AI has no impact on my ability to think or make decisions.  I use it only as an aid, and to assist with drafting or answer a problem for me, but generally I prefer to rely on my own reasoning abilities.",45 - 54,UK,Man
Yes,66bcdf26b58d32e7efba9469,Retired,Yes,Occasionally,5,5,6,5,5,4,3,3,4,3,3,3,3,1,2,5,6,6,1,using ai makes me feel lazy and overwhelmed sometimes,55 - 65,UK,Woman
Yes,66bf59da77f200a4a75a7b62,Student,Yes,Everyday,2,2,5,4,5,3,6,3,5,5,6,6,7,4,5,3,3,3,4,"I worry I have an over reliance on AI tools, and that I will be slower or more likely to overthink simply decisions in the future.",18 - 24,UK,Man
Yes,66c20b634a3b292d25596fbc,Employed full time,Yes,Occasionally,1,1,1,1,1,4,1,1,1,7,7,7,7,1,1,1,7,7,1,"It is no different to gaming, use it sparingly and for fun only, not to be taken seriously",45 - 54,UK,Man
Yes,66c6b37982e002e73e1fbd1c,Employed full time,Yes,Very often,2,5,2,1,1,1,1,2,1,5,1,3,2,1,1,2,5,4,1,"I do not think using digital or AI tools hinders my ability to make decisions or think clearly. However, it can make it more difficult to rest my mind afterwards, because of the large input of new information that usually comes with how I use these tools.",25 - 34,US,Woman
Yes,66ccdd9f6b12c6ea6fa01f42,Employed full time,Yes,Everyday,2,3,3,4,3,5,7,6,6,4,6,5,2,2,2,4,6,4,4,I use it like it is my partner in crime to tackle anything that is needed. The AI helps me but I make sure to review it with other sources before a decision ,25 - 34,US,Man
Yes,66cfab152c56aa0472529001,Employed full time,Yes,Often,3,2,2,1,1,2,5,4,3,3,2,2,2,3,2,3,6,5,2,sometimes i can have thoughts replaying in my mind after work with certain inputs i have made throughout the day. i generally am able to switch my mind away from it quite esy though,45 - 54,UK,Man
Yes,66d035e529e80315f590ecce,Homemaker / caring for family,No,Sometimes,4,5,6,5,6,3,2,6,1,5,5,5,7,2,2,6,6,6,5,I think it can be a bit overwhelming at times using all these tools and yes your mind can feel a little overstimulated afterwards ,45 - 54,UK,Woman
Yes,66d1fdd400acfdbc181f41e0,Self-employed / freelance,Yes,Very often,3,5,5,6,3,5,2,1,3,6,6,6,6,3,3,3,5,5,2,"sometimes the answers you get are so perplexing, or seem tailored to want the ""please you"", you have to constantly check the work or fix mistake after mistake which takes even longer and is more taxing than not using it at all. ",45 - 54,US,Man
Yes,66dd8fd2905d609d29ccf008,Retired,No,Never,3,4,2,3,1,1,1,1,1,1,1,1,1,1,4,5,5,4,4,"I sometimes find it hard to switch off from using digital devices. But when I am able to stay away from them for a good period of time, my mind feels calmer and I am able to concentrate on something else. However, I will be inevidentally drawn back,  as some things that I do rely on digital devices",Over 65,UK,Woman
Yes,66e4d86dc6b20335f135a8e5,Employed full time,Yes,Sometimes,3,6,2,2,3,2,5,3,3,3,5,5,3,2,2,2,2,2,1,"Using digital or AI tools helps me think more clearly by walking me through the thought process of how we arrived at the answer and why it makes sense.It helps me make decisions usually by providing many thoughts, sides, or perspectives on things that I may not have thought of. Then, I can better make my choice or decision because I have more information or perspectives on the subject. I wouldn't say AI or digital tools rest my mind, per say. I do feel like it lessens the load and allows me to use less brain power, which makes the whole thing easier and less stressful.",35 - 44,US,Woman
Yes,66e62716a40afa9a9b4d23c6,Employed full time,Yes,Very often,5,1,1,5,1,1,6,6,2,2,1,1,1,1,1,1,5,5,1,using AI tools helps me to see things in different ways. it helps me make decisions faster,35 - 44,US,Man
Yes,66ea02ae73ad513dcad2953d,Employed part-time,Yes,Often,3,3,2,4,1,1,2,2,1,5,2,4,3,1,1,2,5,4,1,"Whenever I ask AI something and it gives me the answer and I use the answer, even if I rephrase it I doubt if I truly understand it.",18 - 24,US,Woman
Yes,66ecded667f721bca7e5609d,Employed full time,Yes,Sometimes,4,4,4,4,4,4,5,4,3,4,4,4,4,1,1,1,4,4,1,I think AI makes decision making easier in general which makes everything more clear. ,25 - 34,US,Man
Yes,66edc72a30ec9b38153f1b50,Employed full time,Yes,Sometimes,3,4,3,5,2,1,5,2,1,2,2,1,1,1,1,1,1,1,1,I don't think using AI tools affects my decisions or thought clarity at all.,45 - 54,UK,Woman
Yes,66f4461fe6cf2a459a3e7180,Employed full time,Yes,Rarely,4,5,4,5,2,4,2,1,7,7,4,4,7,1,1,5,7,7,1,It makes it harder for me to figure things out on my own. ,25 - 34,US,Woman
Yes,66f47421b650b6c39e80fa0d,Employed full time,Yes,Everyday,3,1,1,4,1,1,6,4,2,3,1,1,2,1,1,4,4,2,1,"It helps me to make decisions and do my job, but it doesn't affect my ability to think clearly because my mind is sharp no matter what due to how it naturally works & analyzes.",35 - 44,US,Woman
Yes,66f62be3ddc65a4d74c7dafd,Employed part-time,Yes,Everyday,5,3,3,1,1,1,6,4,5,2,2,4,2,3,1,1,3,2,3,Using AI tools helps me make decisions and see things clearly. I don't have a need to 'rest my mind' because of using AI tools. AI tools helps me see things and find solutions to things much more quickly and from various 'perspectives' than I could ever glean myself and or with others within a quick timeframe. ,55 - 65,Australia,Woman
Yes,66f69dcc061074dacb886b52,Employed full time,Yes,Often,3,4,5,5,3,3,5,5,6,6,5,5,6,2,2,3,5,4,3,It allows me to bounce around ideas with the AI and ultimately helps me form a conclusion or better understanding of something. I can ask any questions i may have no matter how poor they are and put my mind at ease by finding things out quickly.,25 - 34,UK,Man
Yes,66f87d84fcfe786a13ff1edb,Retired,Yes,Sometimes,3,2,4,5,2,2,1,4,1,4,3,3,5,1,1,1,4,6,1,"I can always think clearly, I tend to use AI purely for information gathering and solutions to research and general enquiries ",Over 65,UK,Woman
Yes,66fa1820329fa9bb88f2e3c6,Student,Yes,Very often,6,5,3,6,3,2,2,2,1,5,5,5,6,2,2,2,6,3,2,It makes me think more to try and refine an output that i want the ai to produce but relying on everday decisions for ai make me feel reliant and incapable of thinking,18 - 24,UK,Man
Yes,66fa9fa782a3e345cd55a7ef,Employed part-time,Yes,Occasionally,4,5,4,5,5,5,2,3,3,4,6,5,4,5,5,6,5,6,4,it makes me feel heavily reliant on it and not think clearly because I am so heavily reliant on it,18 - 24,UK,Man
Yes,66fd3f6c93c24ecc119be354,Unemployed and looking for work,No,Occasionally,5,2,2,6,1,1,1,3,1,3,2,2,1,1,1,1,4,4,1,Makes me know that ive got a wealth of knowledge that i havent learnt yet.,35 - 44,UK,Man
Yes,6704539fe462b87182866f14,Employed full time,Yes,Everyday,5,6,5,4,6,5,5,6,5,6,2,3,2,6,3,5,4,5,6,"I don't think it does, it just allows me to process and generate more output",35 - 44,UK,Man
Yes,67059d99d1093140330a3926,Employed full time,Yes,Very often,3,3,5,5,6,3,5,6,7,6,7,7,7,2,2,1,3,4,1,it makes me less competent in making my own decisions and performing actions. ,18 - 24,UK,Woman
Yes,6712fe1173dfa2bfa2d6294b,Unable to work due to illness or disability,No,Occasionally,1,3,5,2,2,2,2,5,2,2,5,6,7,1,1,1,1,4,1,"I think using AI makes decisions really easy for me. So when I do use AI tools, I feel as I don't think clearly or at my best because I am relying so much on the AI tool instead of my own thoughts.",25 - 34,US,Man
Yes,6716152e33a2af901d7e9196,Unemployed and looking for work,Yes,Occasionally,7,7,7,4,7,7,5,3,3,7,7,7,7,5,6,7,6,7,3,"I feel like AI takes away my ability to exercise mental muscles, to keep functions such as original thinking and understanding processes through doing in tact. I worry that the demand to use AI will result in me relying on it to think for me, and strip me of the ability to think unique thoughts or produce original work; it somehow takes away my joy and sense of achievement I felt in the past in completing a task and producing useful results for a business myself, when the AI can do most of the work.",35 - 44,UK,Man
Yes,6716f188b131fa30ab5365c2,Employed full time,Yes,Often,3,2,2,2,2,2,5,5,4,5,6,5,5,6,5,5,6,4,3,Whenever I use AI and it gives me advice that doesn’t turn out good it messes with my thoughts and mind.,35 - 44,US,Man
Yes,6718343c82dda1264ded40d6,Retired,Yes,Everyday,2,2,2,5,1,1,2,4,2,2,1,2,4,2,1,1,2,1,2,I do not really think AI effects my ability to thing. It allows me to access information quickly ,Over 65,US,Woman
Yes,6718351cc76aa98d9fab14c3,Self-employed / freelance but also looking for work,Yes,Often,5,4,6,4,4,5,2,4,4,5,6,5,6,2,2,2,5,4,2,Excessive use of digital or AI tools can lead to it becoming a habit where you simply use the digital or AI tools to make decisions for you and you end up not thinking at all.,25 - 34,New Zealand,Man
Yes,6719280d44c996e04f9a5475,Employed part-time,No,Sometimes,5,5,3,3,1,1,4,5,4,5,2,2,2,1,1,1,1,1,1,"It helps me to reach the right conclusions or results by usually re-enforcing what I already believed, bringing me relief and confidence and usually saving me time.",55 - 65,UK,Woman
Yes,671a5785170a0f6380c51f28,Employed part-time,Yes,Often,5,4,3,5,2,4,3,3,2,3,2,3,3,3,3,3,5,5,1,It’s just so much screen basically,25 - 34,UK,Woman
