consent,prolific_id,work_status,ai_tools_use,ai_tools_frequency,mentally_taxed_ai_prompts,ai_info_trust_drains_focus,switching_ideas_ai_flow_harder,meta_thinking_when_using_ai,lose_track_own_vs_ai_thoughts,brief_ai_sessions_mind_cluttered,rely_ai_suggestions_decisions,follow_ai_over_instinct,less_confident_without_ai_input,ai_decides_detached_from_outcome,question_if_decision_truly_mine_ai,ai_blurs_judgment_automation,worry_ai_weakens_independent_decisions,mind_replays_ai_interactions,hard_to_switch_off_after_ai,need_time_away_to_feel_myself,short_ai_breaks_clear_head,day_disconnected_ai_calm_grounded,uneasy_without_ai_long_periods,open_text_ai_effects_on_thinking,age_group,country,gender
Yes,5460ef52fdf99b49ea4b5906,Employed full time,Yes,Often,2,5,2,3,1,2,4,2,3,2,1,1,3,1,1,3,4,4,1,"It generally helps me to make decisions, especially when needing to compare things or decide the most suitable product or course of action. I feel I can think clearly with or without AI tools.
I do find the amount of information and text from AI tools slightly overloading sometimes, so if I used it too much I would definitely need a break from it.",35 - 44,UK,Man
Yes,546ec14dfdf99b2bc7ebd032,Self-employed / freelance,No,Never,1,2,1,1,1,1,1,1,1,6,6,7,7,1,1,4,6,7,1,"I don't trust AI, and I don't trust people who use AI. I make fun of AI whenever I do a survey with AI chatbot in it. The liberal bias is obvious. Woke is written into it, and I pity people who need woke AI to tell them how to think. I prefer to use my own mind. I can think for myself. ",55 - 65,US,Man
Yes,55848744fdf99b574f55ada0,Employed full time,No,Occasionally,2,6,4,2,1,5,1,1,1,1,2,4,2,6,2,7,7,7,1,"It's distracting because you have spend more time trying to evaluate if you have been given factual information, and weighing up the option given to you by AI, it really just adds to your cognitive workload.",45 - 54,UK,Woman
Yes,5589b65afdf99b118adfa595,Self-employed / freelance,Yes,Often,4,5,5,4,5,5,3,2,3,5,5,4,4,2,3,4,6,3,4,"It allows me to sort of rest my mind, but I feel it's hard to get back into my rythym iff I spend too much time with AI",25 - 34,US,Man
Yes,558fff05fdf99b3f7aada357,Employed full time,Yes,Occasionally,3,2,4,4,3,2,1,2,2,1,2,3,6,1,1,2,3,2,1,"I'm not dependent on AI. Occasionally I'll use it for quick answers if I'm too lazy to research something or make a decision myself. I see AI as a way to minimize thinking instead of constantly worrying about how to use AI. Since I have always been skeptical of AI and it's overall helpfulness, I'm more likely to doubt any results I get rather than to trust them blindly.",35 - 44,US,Man
Yes,5591cd21fdf99b63126f6c60,Employed full time,Yes,Often,1,1,3,2,1,1,1,3,1,6,4,2,7,1,1,1,7,5,1,"I feel it encourages me to refine my ideas, which makes me think more. ",35 - 44,US,Man
Yes,559bbbdafdf99b7ce19d5b3d,Employed full time,Yes,Very often,3,4,3,2,1,2,5,3,4,2,4,5,5,5,4,2,3,3,3,"Sometimes AI feels like too much of a shortcut, like a lot of the thought process of a decision goes out of the window and it becomes a different kind of process, just comparing an AI's output. I do feel this fundamentally changes something about how we arrive at decisions using evidence and statistics. ",35 - 44,UK,Man
Yes,55bd8669fdf99b5bfc7d4cfc,Employed full time,Yes,Often,2,4,2,6,1,1,2,1,1,6,1,1,7,1,1,1,7,5,1,I use AI like a partner working together each providing information for a decision so no mental effect really,25 - 34,US,Man
Yes,55eee81b9df9fe000efae1d4,Employed full time,Yes,Sometimes,5,7,6,6,4,5,2,2,1,5,7,7,7,1,1,7,7,5,2,There's just so much of it going on,35 - 44,UK,Woman
Yes,56153d5e7ffc8a000a811ba8,Self-employed / freelance,Yes,Occasionally,4,4,5,7,1,5,1,4,2,5,4,5,7,5,5,4,6,7,1,it can give me a lot of info to ponder about,35 - 44,UK,Woman
Yes,5654175604212700054a12b1,Employed full time,No,Rarely,5,5,3,1,1,1,1,2,1,3,2,2,4,1,1,1,1,4,1,AI has not affected my ability to make decisions or think clearly,25 - 34,US,Man
Yes,56a25853dbe850000cfcd1e4,Self-employed / freelance,No,Rarely,4,5,4,4,2,5,1,2,2,6,3,5,6,3,5,6,5,5,6,"I think generally spending too much time on screens clutters your brain and because of the stimulation, when you leave it, there is always some time afterwards where you think you should go back to get this done or look up that or check email. ",45 - 54,UK,Woman
Yes,56b10faa6399f90011da710d,Employed full time,Yes,Very often,4,4,3,6,2,2,5,7,3,2,3,4,6,3,2,5,6,4,1,It can affect me sometimes but I take breaks for my mental health ,35 - 44,UK,Woman
Yes,56b6e2fcf2fc70000c32f9d5,Employed full time,Yes,Very often,5,3,5,4,4,4,6,3,5,6,5,5,7,2,2,3,3,3,3,i find I don't trust my own judgement or I a hard on myself when AI produces something better. I worry that I don't seem to be able to 'think through' problems any more,45 - 54,UK,Woman
Yes,56b78f11e77ebe000cbefe79,Employed part-time,Yes,Occasionally,5,7,6,3,3,2,2,2,2,4,4,6,6,5,4,4,5,5,3,"I think it mainly comes under the heading 'TMI' or 'information overload'. AI responses often try to be all things to all people in a single response. It would be easier to assimilate information or guide the AI in the direction I want to go, if conversations started with brief introductions to ideas and themes and allow me to choose which to develop and in what order. The lack of sources or references/credits is enormously frustrating and in general I am uncomfortable with the way AI adopts and presents ideas as their own rather than the scientist or professional who is really responsibly. Sometimes the length of responses is off-putting and written in styles that are not easily accessible ie need to read a few times to ger the sense of the comments due to unusual vocabularly or sentence structure. All this is like 'noise' over and above the analysis and decision I am trying to progress.",55 - 65,UK,Woman
Yes,56b8ad1be1d0a2000c154093,Self-employed / freelance,No,Rarely,7,7,7,4,4,7,1,1,1,4,4,4,6,2,1,4,4,4,1,"AI output isn't always accurate, and it doesn't always understand exactly what you are looking for, and being alert for this and double checking is time consuming and tiring. Even so, AI doesn't impact my ability to think clearly, or 'think for myself'.",55 - 65,UK,Woman
Yes,56c6f9efb0b7a1000c5d12d7,Employed full time,Yes,Sometimes,3,4,6,4,3,3,5,3,6,5,4,5,6,3,2,6,6,4,2,"It makes systems and processes easier to deal with, and so reduces my own independent thought - I question if my own choices are the right ones and often feel the need to double check with AI",45 - 54,UK,Man
Yes,572bcdbb34b25a0010ddd977,Employed full time,Yes,Everyday,4,5,5,5,3,2,4,3,2,4,4,5,5,1,1,2,6,4,2,"Ai doesn't really affect my thinking in a deep way, I usually use AI as a support in my decisions. Sometimes it can help me to clearify some doubts but the final decision is always mine. ",45 - 54,UK,Man
Yes,573f3168d700ea000ff433a6,Employed full time,Yes,Often,3,6,3,5,3,6,6,3,7,3,7,6,6,2,3,6,6,4,1,"It's hard to unblur the lines between where I end and where AI starts. I sometimes ""hallucinate"" and think that my words were made by the AI and vice versa. ",35 - 44,UK,Man
Yes,57439a4354636a000d78639a,Employed full time,Yes,Often,2,2,2,2,2,2,4,4,2,2,3,4,5,2,1,1,1,1,1,"It allows me to free up time to do other important things because it takes the thoughtless tasks off my hands and handles them quickly, more quicker than I could. I still have input when it comes to how I do my job. ",35 - 44,US,Woman
Yes,57a7326516a091000112edb2,Employed part-time,Yes,Sometimes,4,4,4,5,3,3,3,3,3,4,5,5,4,5,4,3,4,3,3,"I don’t really have too much of an issue in thinking clearly, making decisions  or resting my mind after using AI but there are times when I feel that it improves my confidence when I do so and I’m less sure of myself without it sometimes ",Over 65,UK,Woman
Yes,5803cb9a3073510001231d82,Employed full time,Yes,Sometimes,3,5,3,4,1,2,2,3,1,4,5,3,6,1,1,3,6,5,1,it helps with the advice I need to give but when I'm not 100% sure my advice is correct,55 - 65,UK,Woman
Yes,580cab86b869700001d71628,Self-employed / freelance,No,Occasionally,7,7,7,7,7,7,3,2,2,7,7,7,7,1,1,7,3,2,1,When I need books to read and clarification on news or a concept I don't get.,55 - 65,US,Prefer not to say
Yes,587249a2e9cb31000195ed09,Unable to work due to illness or disability,Yes,Rarely,6,5,4,2,1,2,2,2,1,5,6,2,5,1,2,2,2,4,1,"It doesn't really _ I use it for programming, so can test the results and adjust without too much thought.",55 - 65,UK,Man
Yes,587625efdb3e720001e233fb,Unemployed and looking for work,Yes,Sometimes,2,5,2,5,3,2,3,3,4,3,2,3,5,1,4,2,3,5,3,Sometimes I get a thought and get distracted talking to the AI about it instead of doing more productive things.,25 - 34,UK,Man
Yes,58954e2dc88c680001dd4b7e,Employed part-time,Yes,Sometimes,5,5,6,5,6,6,4,3,3,5,5,5,4,4,5,5,6,5,3,"I try stay away, Best I can, it's overload and contradictory , sometimes fun, but only fir a short period, I'm 60, I don't need this ",55 - 65,UK,Man
Yes,58bfee7de5869400018f5e9e,Employed full time,Yes,Everyday,5,6,4,5,6,3,5,6,3,5,6,6,5,6,4,3,7,5,4,It affects my critical thinking,35 - 44,UK,Man
Yes,58f0fca0d40252000192f201,Employed full time,Yes,Often,4,4,3,3,2,2,3,4,5,3,3,2,5,2,2,2,2,3,2,I honestly don’t think it effects it but I do rely on it more and find myself not trying to think as hard ,35 - 44,US,Man
Yes,59497c498fb2140001afda85,Employed full time,No,Occasionally,4,4,3,4,2,4,2,3,2,4,4,4,4,4,4,6,4,4,4,As the work is done for you. ,25 - 34,UK,Woman
Yes,594ea461c6a70f00010aaa8d,Employed full time,Yes,Very often,3,2,3,2,2,2,3,2,2,3,3,2,3,3,3,2,5,3,2,It makes you forget how to think for yourself ,55 - 65,UK,Woman
Yes,5953d01e4d560700016462da,Unable to work due to illness or disability,Yes,Everyday,2,3,1,1,1,1,1,1,1,1,1,1,1,1,1,1,1,1,1,"It doesn't affect me negatively. Instead, since I can be mentally and physically fatigued due to medical issues, it helps me with tasks related to managing my medical stuff. For instance, I might give it the info that I want to convey during an upcoming appointment and then have it clarify and condense that to make it more effective. This saves me time and energy and makes me more likely to succeed at my appointment. This helps me to rest my mind by being more easily prepared.",55 - 65,US,Woman
Yes,5962a5b29955ee00015bce98,Self-employed / freelance,Yes,Sometimes,5,6,4,5,2,5,2,2,6,4,2,4,5,2,4,5,6,4,5,"It helps me to summarise potential negative outcomes of a decision and have a list of pros and cons to consider, in order to make a faster decision without a lot of research.",25 - 34,UK,Prefer not to say
Yes,59710ac7b174180001757d6a,Employed full time,No,Occasionally,2,1,2,2,1,1,1,1,1,4,3,4,4,1,1,1,3,1,1,I don't use it a lot. So minimum impact. ,35 - 44,UK,Man
Yes,597e0d5f37978a00016b4e6a,Employed part-time,Yes,Sometimes,2,2,2,1,1,1,5,3,3,4,2,5,5,6,6,4,4,3,1,I find I increasingly ask and act on advice from AI tools. Im obviously not using my own ability to research/make decisions when I do this. I guess I do worry a little that Im becoming a bit dependant on AI. I would not say it puts my mind at unrest exactly but I do get a bit too involved sometimes.,45 - 54,UK,Woman
Yes,5980fff19bf4fe0001070984,Self-employed / freelance,No,Occasionally,3,6,2,4,2,3,2,1,1,1,3,4,6,5,3,7,2,2,1,It sometimes impairs my thinking as I look to AI to help me clarify a decision I've made`,45 - 54,UK,Man
Yes,5987030cfd8cca00015cbc26,Employed full time,Yes,Often,5,4,3,6,3,2,2,2,2,2,4,5,5,1,1,1,2,3,1,"I use it for harder tasks only or rewording my own never just because I can, I still do my own too as do not want to rely on it all the time!",55 - 65,UK,Woman
Yes,59a5b35c5954130001582a40,Employed full time,Yes,Rarely,1,4,4,5,3,3,4,5,5,5,4,5,5,3,3,3,3,3,4,"Using AI tools helps me solve problems which puts me at east. However, i feel like I'm becoming dependent on it which makes me uneasy.",35 - 44,UK,Man
Yes,59ccd702faf42e00012b68f5,Unemployed and looking for work,Yes,Everyday,3,4,4,5,2,4,3,2,3,4,5,5,3,1,1,1,2,3,1,Using AI tools makes me think less hard on topics. I turn to AI instead of thinking deeply on things. ,25 - 34,UK,Man
Yes,59cff8eed227970001199862,Employed full time,Yes,Often,4,5,6,6,5,2,3,4,2,6,5,4,6,1,2,3,5,6,2,"Using digital and AI tools helps me find information quickly and solve problems easily. However, too much can distract me, make thinking harder and disrupt my sleep. When I use them wisely, they improve my decision making. Overuse makes it harder to rest my mind.",45 - 54,UK,Man
Yes,59d3ef2c078dbe000195117f,Employed full time,Yes,Often,1,1,1,1,1,1,2,5,1,1,1,1,1,1,1,1,1,1,1,It doesn’t affect my ability to think clearly. I use it and then move on. ,45 - 54,UK,Woman
Yes,59d4c100078dbe0001951236,Employed part-time,No,Rarely,2,5,4,2,1,2,1,3,1,4,5,6,5,1,1,5,5,6,1,"I think it makes me question my own judgements and thought processes, and I doubt my own abilities",35 - 44,UK,Woman
Yes,59e29e405de9b000017ecebf,Self-employed / freelance,Yes,Sometimes,2,6,2,5,1,1,3,2,1,1,1,2,4,1,1,1,5,2,1,"The only issue I have with AI in how it affects me mentally is that I feel it makes me lazier and dumber in some ways. Like instead of remembering stuff on my own, I might ask an AI with very little information and it always figures out what I was trying to remember. So, I have kind of stopped myself from immediately relying on that unless I really cannot remember the name of something after a while. It's all about balance I guess. It has improved my writing, though.",35 - 44,US,Woman
Yes,59ea2d5a7f3d71000171e0a9,Employed part-time,No,Often,3,6,4,3,1,1,1,1,1,5,1,3,7,2,3,2,5,5,1,I think it makes me reliant on it and damages my critical thinking skills,35 - 44,US,Woman
Yes,5a2c51740a1e6b00016952c8,Employed part-time,No,Occasionally,4,6,4,5,4,4,3,2,2,4,3,4,6,2,3,4,5,4,2,I end up relying on it too much and I think this can stifle my own thinking ,55 - 65,UK,Woman
Yes,5a2ef9bbfd28e9000102ee68,Self-employed / freelance,Yes,Often,3,3,2,2,2,3,4,3,2,5,4,5,5,2,2,4,5,5,2,"I think it's all to easy to become dependant on AI tools, so sometimes I feel that I have too many options with information whilst using it. Breaking away from it makes my head feel clearer, and like I am back in reality again.",45 - 54,UK,Woman
Yes,5a47473899311d0001df550e,Employed full time,Yes,Occasionally,1,2,2,2,1,2,3,1,3,1,3,4,4,1,1,1,1,3,2,"It has no effect at all, I find it a useful tool and see it only as that",35 - 44,UK,Woman
Yes,5a4bf09053a4560001ba0ebf,Employed full time,Yes,Often,2,2,3,3,1,2,2,3,3,2,1,2,2,4,3,1,2,2,3,"I see AI tools as just another source of information and data that I can use to inform some of my decision-making. Ultimately the decisions I make are still mine, and I feel that I think just as clearly as ever.",35 - 44,US,Man
Yes,5a7226d9f660ae0001a9a547,Employed part-time,No,Sometimes,1,1,1,1,1,1,1,5,1,1,1,1,1,1,1,1,1,1,1,"I do not feel it affects my ability to think clearly, make decisions or rest my mind. I am in complete control of when I use it. I only use it for advice, if it conflicts with what I thought I do further research to avoid misinformation but other than that I am in complete control of the situation ",25 - 34,Ireland,Woman
Yes,5a7cb83a000dab00018c530b,Employed full time,Yes,Everyday,2,2,1,5,1,1,7,2,5,1,1,1,1,1,1,1,5,2,6,"When I spend too much time on my laptop working intensively and using digital tools, I experience cognitive fatigue and feel the need to rest my mind.",45 - 54,UK,Woman
Yes,5a8367b9190420000155ec2a,Employed full time,Yes,Very often,5,6,4,4,5,6,4,3,2,5,4,6,6,3,4,7,7,7,2,"These tools can be helpful but I increasingly feel like they are too much, and I want to step away from using them. But I can't, I need them for my work. Everything feels too ""noisy"" when I use these tools - too many distractions, hard to keep focus. The modern world feels so busy and overstimulating. When I'm able to step away, I feel my brain ""relaxing"" and ""breathing"". I always feel so much better, much healthier.",35 - 44,UK,Man
Yes,5a8b61fcf1408d000176b02f,Employed full time,No,Rarely,7,7,4,1,1,4,1,1,1,4,4,4,4,1,1,1,1,4,1,"I hardly ever use AI but when I do,I just do not like how I feel using AI suggestions.  It just does not feel normal or right",Over 65,US,Woman
Yes,5a937cb0dbdb470001ee923b,Employed part-time,No,Never,1,4,1,1,1,1,1,1,1,1,1,7,7,1,1,1,3,3,1,I avoid AI use as much as possible. AI makes me furious. I do feel  irritated by how hard it is to avoid now.,45 - 54,US,Woman
Yes,5a94fbadf05361000171bc25,Employed full time,Yes,Very often,4,4,5,5,5,5,3,1,3,5,6,4,5,5,6,7,7,7,1,It is like I am working on autopilot and I feel like I am less human at times when relying on AI to assist me. It is easier and does help me out and saves time but I do wish it weren't as necessary in this modern world as I don't want to lose brain power.,35 - 44,UK,Woman
Yes,5a973b8235237b0001127686,Employed part-time,Yes,Occasionally,3,5,3,5,2,5,3,2,3,6,2,5,5,5,5,4,6,6,2,"using AI can make me distrust its results. If I don't like the decision made by AI, I will look for reasons why the AI is not correct and/or try to change the outcome. I don't trust AI enough to always trust its output, so it can end up taking me even longer to do things rather than save me time.",45 - 54,US,Woman
Yes,5a9e9fc46219a30001f54994,Retired,Yes,Sometimes,5,3,3,3,2,1,1,1,1,1,1,1,2,2,2,2,2,3,2,if I have a problem digitally I can count on AI,Over 65,UK,Man
Yes,5a9fa90f873cda00010d29d8,Employed full time,Yes,Everyday,5,7,6,3,6,7,3,1,5,5,7,7,7,3,5,6,5,6,7,AI tools confuse me a lot as they often have imputs I want but also imputs I do not like so it makes me stress out sometimes and making decisions becomes harder because I do not know whom to trust anymore.,25 - 34,UK,Man
Yes,5aad8499e1546900019aef29,Employed full time,Yes,Occasionally,2,2,1,1,1,1,3,4,4,3,1,2,2,1,1,1,1,1,3,"It doesn’t really, I probably spend too much time using them but I don’t think it affects my cognitive abilities too much ",25 - 34,UK,Man
Yes,5aafd9eff69e940001d88bf4,Self-employed / freelance,No,Never,7,7,7,4,4,7,1,1,1,7,7,7,7,4,1,7,7,7,1,I don't use digital tools or AI precisely because I don't want to lose the ability to think for myself - to rely so much on AI doesn't feel like progress for humanity at all .,55 - 65,UK,Woman
Yes,5ac50a19a3ba7a0001b4a483,Employed part-time,No,Rarely,1,1,4,1,1,1,1,1,1,1,1,1,1,1,1,1,1,1,1,"They don't. I have only used AI on my own twice, and even though, I asked a simple question, AI answered it, and I was done.",35 - 44,US,Woman
Yes,5aca8df5436f550001000d03,Employed full time,Yes,Sometimes,5,7,3,2,3,5,2,1,3,5,4,3,6,3,4,6,7,3,2,I can get more anxious about making decisions and wonder  if what I'm doing is good enough. It's also easy to be too reliant on AI and not check the results well enough because I want to save time.,45 - 54,New Zealand,Woman
Yes,5acfdb527677430001c8f1e9,Self-employed / freelance,No,Rarely,6,7,7,2,1,5,1,1,1,3,2,3,7,2,3,3,5,1,1,"I think it can make it tough to see what was your decision and what the AI coaxes you to do. Also, it can be tiring to constantly fact check which affects my ability to think clearly",25 - 34,UK,Woman
Yes,5ad78b91b24ddb0001744bc4,Employed full time,Yes,Occasionally,3,5,4,4,2,3,2,5,2,6,6,6,4,4,5,6,6,7,1,I use AI in my work sometimes to help with wording emails that might need a little extra attention. I also use it for some data analysis but have to be careful about the results I get because it’s not always accurate.,45 - 54,US,Woman
Yes,5b07b3959649530001a3c8c5,Employed full time,Yes,Often,1,2,2,2,1,2,1,4,1,4,2,4,2,1,1,1,3,4,1,I find AI a great help and reinforces my own decisions ,55 - 65,UK,Woman
Yes,5b2a2d855b5c0900018b0bf5,Employed full time,No,Occasionally,1,5,1,1,1,2,1,1,1,1,1,1,1,1,1,2,7,6,2,Sometimes I feel like I need to get into the real world after using a computer for a long time. I like to take regular breaks and go for a walk or look at my garden to clear my mind and rest my eyes.,45 - 54,UK,Woman
Yes,5b35824a975e260001e9b7a6,Employed full time,Yes,Everyday,5,6,4,7,3,6,5,1,4,1,1,1,4,5,2,2,5,3,5,It's like a bicycle for the mind; in its absence I can attain the same result but it helps me reach a decision quicker and gives me more clarity since my decision making is largely knowledge dependent.,35 - 44,UK,Man
Yes,5b47e287bc06c90001f8b67d,Employed full time,Yes,Everyday,3,5,3,4,3,3,5,4,3,3,5,5,5,2,2,3,5,3,2,Ai can boost efficiency but can clutter my thinking and drain focus,35 - 44,UK,Man
Yes,5b4991de56e0140001acb76b,Employed full time,Yes,Very often,6,5,6,5,4,6,5,4,5,6,6,5,5,6,4,6,5,6,5,I may become overly reliant on them and so I would end up being unable to make independent judgement especially if the AI is incorrect.,25 - 34,US,Man
Yes,5b4a3ab1bc06c90001f902f4,Employed full time,Yes,Often,5,6,5,6,2,4,2,3,2,5,5,4,5,2,2,5,5,5,2,"Sometimes i'm cautious as i can read something on AI and question it's authenticy, i'm worried the responses are too generalised, a summary of information and therefore may not be accurate, i have concerns about misinformation and disinformation. I have read things that do not answer the question asked even though i consider it to be a simple one so i worry about the understaning of the question from the AI and if it's been answered accurately.",35 - 44,UK,Woman
Yes,5b523bdc608e18000184d8a6,Employed part-time,Yes,Rarely,6,7,1,1,1,1,1,1,1,1,1,1,1,1,1,1,1,1,1,AI tools can make it difficult to tell what is authentic or legitimate in online spaces where it can easily masquerade as human. This can lead to a general distrust in art and writing.,25 - 34,US,Man
Yes,5b5a822e1ad8270001c4f28d,Unemployed and looking for work,No,Occasionally,2,4,4,6,1,5,1,5,1,4,1,1,1,1,1,1,6,3,1,When you use AI tools to help you on a task it loses your own creativity cause you rely on AI too much when you're doing work ,35 - 44,US,Man
Yes,5b68c9eb87af310001584803,Employed full time,Yes,Everyday,5,3,5,7,5,2,7,5,6,5,2,3,3,5,5,6,6,5,3,it provides me with useful information that is unique and personal which makes me feel at ease,25 - 34,UK,Man
Yes,5b70d5cf48302c0001ba0771,Employed full time,Yes,Very often,2,2,1,4,2,2,5,5,2,1,5,3,3,2,1,4,6,1,2,It gives me clarification in real wording on my thoughts,55 - 65,UK,Man
Yes,5b7bc048338a93000155167e,Employed full time,Yes,Very often,3,2,2,1,2,1,4,2,4,3,5,5,6,2,2,4,5,4,1,My mental ability is certainly negatively affected because I don't have to use my brain much when using AI tools. They do the work for me.,45 - 54,UK,Woman
Yes,5b82d4fda284bc000193094c,Employed full time,Yes,Often,4,3,3,3,1,2,5,5,3,4,3,5,3,4,3,3,6,5,2,"It makes it easier for me to remember good ideas and to make decisions. And offers conceptual clarity and distinctions, making me think clearly.",25 - 34,UK,Man
Yes,5b844bb6db11320001c56ca3,Unable to work due to illness or disability,Yes,Very often,1,4,1,4,1,1,4,4,6,6,4,4,7,4,4,4,4,4,4,I think it affects my ability to think for myself sometimes ,25 - 34,UK,Woman
Yes,5b8733a8dd068d0001be4a5f,Employed full time,Yes,Everyday,4,3,2,4,1,2,3,5,2,5,2,5,4,2,1,1,3,3,1,"If used in moderation AI tools don't really have much of an effect on my ability to think clear, but after using them for extensive periods of time it can become harder to distinguish at times between your own thoughts and those you have seen as responses via AI tools.",25 - 34,UK,Man
Yes,5bbf866512eafa0001230094,Employed full time,Yes,Often,3,5,3,3,3,3,5,3,3,3,4,4,5,3,3,3,5,4,4,"AI is good for helping me organize my thoughts, but sometimes I worry about too much input from it affecting my decisions or potentially putting me in an echo chamber of sorts.",25 - 34,US,Woman
Yes,5bddfba7712eb800010d3a61,Self-employed / freelance,Yes,Very often,6,6,6,6,6,6,6,3,6,6,6,6,6,5,5,5,4,4,4,I maybe become dependant on it about taking decisions or writing properly and makes my brain a bit lazy,55 - 65,UK,Woman
Yes,5be9b18df5c1060001085048,Employed full time,Yes,Occasionally,3,2,1,3,1,1,4,4,2,2,1,2,3,1,1,1,3,1,1,i use it in work to help with stock control honestly it help me well,35 - 44,UK,Man
Yes,5bec8599fdf8c50001d0d329,Employed full time,No,Never,4,6,2,1,1,3,1,1,1,2,6,7,7,1,1,4,5,4,1,"I think using ai prevents you from using your own brain to come up with solutions to problems. AI will just parrot back to you what you want to hear, not necessarily what you need to hear, and that can be confusing",25 - 34,UK,Woman
Yes,5bf1fca17c3874000169ec57,Mother and student,Yes,Sometimes,6,5,7,7,2,5,2,1,1,5,3,1,5,1,1,1,3,5,3,I have ADHD so sometimes offloading things to AI help me make sense of things when everything seems too much ,25 - 34,UK,Woman
Yes,5bf54dd783653500016776ec,Employed full time,Yes,Occasionally,5,5,4,2,1,4,2,2,2,4,4,5,4,4,1,2,4,4,4,It doesn't ,35 - 44,UK,Woman
Yes,5bf571f03508750001423e07,Unemployed and looking for work,Yes,Very often,6,7,4,1,1,5,4,5,3,1,1,6,7,1,1,7,7,7,3,"I can think clearly even when using AI tools. Even when against a tough question, I'll read what the AI says after my prompt and try to see how it got there, though it is mentally taxing to review. It is also taxing for me to stare at  screen when using my phone for AI, as my eyes are sensitive and over long periods of screen use I get brain fog.",25 - 34,US,Man
Yes,5bf6bbeb31f7850001d24ce2,Retired,Yes,Very often,4,5,5,5,4,5,2,3,4,6,5,5,6,4,4,4,5,6,3,It makes me more indecisive and not trust my own judgement ,45 - 54,UK,Woman
Yes,5bf7290ed5ec8200015d07e7,Employed full time,Yes,Everyday,6,6,6,5,5,7,7,6,6,7,6,7,7,5,5,5,7,6,4,It’s very convenient but often makes me feel guilty when it makes decisions I can not override. ,45 - 54,UK,Man
